,8,"DANIEL WATERS, FACTORY ANSWER, VICTORVILLE, CA"
,,
11 Expert    Total Riders = 67    Groups = 12,,
,1,"KARTER MONTELLANO, FACTORY ANSWER, RIVERSIDE, CA"
,2,"FRANKIE STUBBS, GORDY'S BICYCLES, PHOENIX, AZ"
,3,"COHEN BUNDY, WIAWIS/LSG, FT COLLINS, CO"
,4,"DYLLON REEDER, AVENT/BOMSHELL, WILDOMAR, CA"
,5,"MAX CLARK, ELITE BICYCLES/VENDETTA, CARMICHAEL, CA"
,6,"RILEY ALLEN, RIFT/TANGENT, FORT MILL, SC"
,7,"RYDER LAWRENCE, ALBES, MENIFEE, CA"
,8,"GAIGE GOMOLICKE, BAY AREA BMXERS, UKIAH, CA"
,,
12 Expert    Total Riders = 70    Groups = 12,,
,1,"SEAN (EL SUAVE) DAY, FACTORY FULL TILT/RADIO, TACOMA, WA"
,2,"TRUE (TRUDAT) BAILEY, WIAWIS/LSG, LAKE TAPPS, WA"
,3,"CONNOR EATON, HARO, VALENCIA, CA"
,4,"JOSHUA (LIL BUB) WHITE, SUPERCROSS BMX, KINGMAN, AZ"
,5,"COLE FREDERICK, FACTORY FULL TILT/RADIO, NEW ULM, MN"
,6,"NICO DIAZ, REVOLUTION CYCLING CLUB, AIRDRIE, AB"
,7,"BRADY ONEIL, DAYLIGHT CYCLES, HENDERSON, NV"
,8,"CHASE BULLER, LDC, RODEO, CA"
,,
13 Expert    Total Riders = 68    Groups = 12,,
,1,"CEDRIC (THE ENTERTAINER) CADE, BMX SHARKS, LAS VEGAS, NV"
,2,"RONNIE (THE ASSASSIN) KIM, FACTORY BOX COMPONENTS, CORONA, CA"
,3,"GAVIN STAZETSKI, FACTORY FULL TILT/RADIO, CHARLEROI, PA"
,4,"PARKER RESPASS, WIAWIS/LSG, CHESAPEAKE, VA"
,5,"CANNON (THE HAMMER) WOOD, THRODWN, YUKON, OK"
,6,"DOUGLAS SCHMEICHEL, DRIVEN CYCLING ACADEMY, KUNA, ID"
,7,"MICHAEL BENNETT, NVP/MACHINE TRAINING, NAPA, CA"
,8,"ROBERT (WASABI) CONNELLY, FACTORY RIFT TANGENT, BRENTWOOD, CA"
,,
14 Expert    Total Riders = 63    Groups = 11,,
,1,"BLAISE (BLAZING) PEREIRA, FACTORY FREE AGENT-BOX, MARRERO, LA"
,2,"JACOB TRUJILLO, FACTORY ANSWER, RANCHO PALOS VERDES, CA"
,3,"JOSHUA TRERISE, FACTORY FULL TILT/RADIO, SHERWOOD, OR"
,4,"JAYCE BARTLEY, LDC, MILWAUKIE, OR"
,5,"GAGE BROWN, FACTORY YESS, BEND, OR"
,6,"DREW ENGLER, WIAWIS/LSG, BLUE SPRINGS, MO"
,7,"CARSON KOWASKI, FACTORY RIFT CANADA, INNISFAIL, AB"
,8,"ALEX (FLEX) FERGUSON, MANGLER, MUKWONAGO, WI"
,,
15 Expert    Total Riders = 58    Groups = 10,,
,1,"BRODY COLE, FACTORY FULL TILT/RADIO, SPRING, TX"
,2,"CAMERON (WINGDING) WING, FACTORY PICKLE JUICE, ROWLETT, TX"
,3,"PETER CHOAT, THRODWN, BAKERSFIELD, CA"
,4,"COLE ZUFELT, C-YAA, TRENTON, ON"
,5,"MIKKEL DEVORE, VERADALE, WA"
,6,"CHRISTOPHER HOBBIE, FACTORY BLACKCROWN BMX, MANAHAWKIN, NJ"
,7,"CHARLIE BIGGS, FACTORY FREE AGENT-BOX, BELMONT, NC"
,8,"NOLAN CARDWELL, RIVAL RACING, BELMONT, NC"
,,
16 Expert    Total Riders = 47    Groups = 8,,
,1,"NICHOLAS (QUICK NICK) ADAMS, ROCKSTAR RIFT TANGENT, ORANGEVALE, CA"
,2,"DYLAN WOOD, FACTORY FULL TILT/RADIO, HOUSTON, TX"
,3,"EVAN SCHAEFER, ALLTOW WRECKING CREW/YESS, SARASOTA, FL"
,4,"AMAKYE ANDERSEN, DAYLIGHT CYCLES, TUCSON, AZ"
,5,"KYLE JENSEN, PURE/AVIAN USA, TUCSON, AZ"
,6,"TYLER WRIGHT, STATELINE BMX, POYNETTE, WI"
,7,"DREW POLK, WIAWIS/LSG, AVON, IN"
,8,"BILLY RATCLIFF, BALLISTIC BMX, ABBOTSFORD, BC"
,,
17-20 Expert    Total Riders = 52    Groups = 9,,
,1,"JESSE WELCH, THRODWN, PERRIS, CA"
,2,"BRAYDEN (THE BULLET) KEMPEL, ALPHA, RAMSEY, MN"
,3,"RACE LEE, FACTORY FULL TILT/RADIO, DERBY, KS"
,4,"JOSEPH LETO, ALLTOW WRECKING CREW/YESS, MYAKKA CITY, FL"
,5,"CADEN BOWERS, FAITH/RACE INC., WARSAW, IN"
,6,"ALEX ANTIL, SAINT MICHAEL, MN"
,7,"MAX AUSTIN, VELOCITY BIKE CO, BOZEMAN, MT"
,8,"CAMERON BRAMER, WIAWIS/LSG, SOUTH PARK, PA"
,,
21-25 Expert    Total Riders = 23    Groups = 4,,
,1,"SHANE HARLOW, ELITE BICYCLES/VENDETTA, MORENO VALLEY, CA"
,2,"JEREMY NOTHOM, ST CLOUD, MN"
,3,"JAKE SHEPHERD, BMX ELITE, BUCKLEY, WA"
,4,"CHRISTOPHER (MUSTACHIO) PETERIE, LANDSTAR RACING, JENKS, OK"
,5,"RAMON FERREIRA LEAL, CYCLE CRAFT, ORLANDO, FL"
,6,"JASON KULLMAN, RRC-SUPERCROSS-FLY, HENDERSON, NV"
,7,"JUSTIN GAEDTKE-SCHWARTZ, FACTORY SSQUARED, WISCONSIN RAPIDS, WI"
,8,"CURTIS (HOLLYWOOD) GARLICK, NAPA VALLEY PULL, NOVATO, CA"
,,
26-35 Expert    Total Riders = 22    Groups = 4,,
,1,"JASON MORRIS, SE RACING, MORENO VALLEY, CA"
,2,"MARC ESTEP, BELLFLOWER, CA"
,3,"BRADY LAVOI, FULL TILT/RADIO, ST. CLOUD, MN"
,4,"KYLE ROBINSON, RACE INC, PENDLETON, IN"
,5,"BILLY KORMAN, FORT COLLINS, CO"
,6,"JUSTIN DODSON, FACTORY GOLD'S GYM, ROYSE CITY, TX"
,7,"CHRIS SUTTON, FACTORY ANSWER, GLENDALE, AZ"
,8,"CODY (THE REALTOR CODY) HARRIS, BMXTC, NAMPA, ID"
,,
36-40 Expert    Total Riders = 31    Groups = 6,,
,1,"ADAM (NINJA) WELTER, VENOM/BMA, EAGAN, MN"
,2,"LONDON JOHNSON, BAY AREA BMXERS, CAMPBELL, CA"
,3,"GEORGE (THE MANGLER) ANDREWS, MANGLER BMX, DAVIS JUNCTION, IL"
,4,"RYAN BUNKER, ..., VALRICO, FL"
,5,"GREG CUSTER, FACTORY BLACKCROWN BMX, BRIDGETON, NJ"
,6,"RICHARD GRESHAM, SEMINOLE, OK"
,7,"MICHEL PERKINS, BOIS-DES-FILION, QC"
,8,"JAKE BROWN, FACTORY ALPHA, STOCKTON, CA"
,,
41-45 Expert    Total Riders = 21    Groups = 4,,
,1,"CHAD STREET, FACTORY GOLD'S GYM, RICHLAND HILLS, TX"
,2,"ROBERT TAYLOR, LANDSTAR RACING, BAYTOWN, TX"
,3,"JASON SILVA, GORDY'S BICYCLES, GLENDALE, AZ"
,4,"PAULO MOREIRA, DL TRAINING ,POWERCYCLE, ORLANDO, FL"
,5,"BRANDON SMITH, SMITH BROTHERS, OKLAHOMA CITY, OK"
,6,"MARK JACKSON, BAY AREA BMXERS, FREMONT, CA"
,7,"GLENN MCKINNEY, PASADENA, MD"
,8,"BRENT LEE, BAY AREA BMXERS, UNIVERSITY PLACE, WA"
,,
46-50 Expert    Total Riders = 21    Groups = 4,,
,1,"RENATO SILVA, ALLTOW WRECKING CREW/YESS, WINTER GARDEN, FL"
,2,"KEN HEXIMER, ARIZONA BICYCLE WERX/FALL RISK RACING, GLENDALE, AZ"
,3,"ERIC HUBER, BLOT OUT GRAPHICS, IJAMSVILLE, MD"
,4,"DREW MOTLEY, FACTORY YESS, ORMAND BEACH, FL"
,5,"BEAU FURR, GT , SAN MARCOS, CA"
,6,"MICHEAL (SENSEI) ERVIN, VELOCITY BIKE CO., AURORA, CO"
,7,"AL ROYBAL, FACTORY ANSWER, PRUNEDALE, CA"
,8,"DONOVAN MILLER, FIDELIO DOG WORKS, AUSTIN, TX"
,,
51 & Over Expert    Total Riders = 16    Groups = 3,,
,1,"BOB CULLISON, ROCKET RACING, CHESTERFIELD, VA"
,2,"JEFF INGRAM, FACTORY YESS, KELOWNA, BC"
,3,"TROY (TROYBOY) WASKOM, INDY 4130, FREETOWN, IN"
,4,"MONTY CAVADINI, YESS, FERNDALE, WA"
,5,"JOHN PRINGLE, PROFILE RACING, ARCHER, FL"
,6,"ROBERT RAYMONDE, YESS, RIVERSIDE, CA"
,7,"CHANCE BALSANO, SOUTHHAVEN, MS"
,8,"SCOTT BEGA, 2-CYCLE MICHAEL’S, HAYSVILLE, KS"
,,
