,8,"ERIC SWEETS, BAY AREA BMXERS, LAS VEGAS, NV"
,,
56-60 Cruiser    Total Riders = 21    Groups = 4,,
,1,"ERIC RUPE, REDLINE/OAKLEY/UGLY KID CLOTHING, WOODLAND HILLS, CA"
,2,"JIM GARRETT, BIKE ALLEY, DOWNEY, CA"
,3,"TURNELL HENRY, LAS VEGAS, NV"
,4,"SCOTT (OLD SKOOL) SLOAN, INDEPENDENT ALL STAR, COPPELL, TX"
,5,"BEN TROIA, ELITE BICYCLES/VENDETTA, AUBURN, CA"
,6,"SCOTT ANGUS, JR BICYCLES.COM/SPEEDCO/AVIAN, MORENO VALLEY, CA"
,7,"TROY (TROYBOY) WASKOM, INDY 4130, FREETOWN, IN"
,8,"TIM MERRITT, FASTBACK RACING, POWDER SPRINGS, GA"
,,
61 & Over Cruiser    Total Riders = 11    Groups = 2,,
,1,"JIM DERVIN, WHITETHORN, CA"
,2,"DENNIS (YOGI) YBARRA, KBCO, FLINT, MI"
,3,"DANNY (BIONIC MAN) BUSHNELL, THE BIKE MASTER, VANCOUVER, WA"
,4,"ALBERT PATTERSON, FACTORY PICKLE JUICE, DALLAS, TX"
,5,"CHUCK (MR STYLIN’) FIELDSON, STYLIN, ONEIDA, NY"
,6,"VINCE THOMAS, EXTREME TEAM, GLENDALE, AZ"
,7,"PAUL (OLD GUY) MOUNSEY, ICE, BEDFORD"
,8,"RICH (SUSPENDERMAN) MUNDELL, THE BIKE MASTER, TACOMA, WA"
,,
5 & Under Novice    Total Riders = 43    Groups = 8,,
,1,"JERONIMO NORIEGA, SIMPSONVILLE, SC"
,2,"THEODORE (HANDSOME) TENORIO, DAD, ALBUQUERQUE, NM"
,3,"KAIDEN (KK) ROCHA, SWAT, SHADOW RIDGE, BEAUMONT, CA"
,4,"GRAHAM (INSTA-GRAHAM) SPEIGEL, YUKON, OK"
,5,"JACE LERNER, DAVISON, MI"
,6,"CHAYTON RHODUS, HOSTILE BMX, OZARK, MO"
,7,"GREYSON CURTIS, RIOT, SAUK RAPIDS, MN"
,8,"CREIGHTON HARVES, BICYCLE SHACK, BLUE SPRINGS, MO"
,,
6 Novice    Total Riders = 19    Groups = 3,,
,1,"ROMAN (RECON) ROSAS, MAKE READY, LAS VEGAS, NV"
,2,"KAIDEN WAGNER, GRANDPARENTS, MISHAWAKA, IN"
,3,"NOAH (BAM BAM) HOLCOMB, GERMANTOWN, TN"
,4,"BYRON WILSON, MESQUITE, TX"
,5,"SAMUEL SCHWARTZ, ELK POINT, SD"
,6,"ELLIOT BERGMAN, BULLSEYE CYCLE, WAUKESHA, WI"
,7,"EMMETT COOK, SSQUARED SOUTHEAST, NOLENSVILLE, TN"
,8,"NICHOLAS (SAINT NICK) BARTON, GLENCOE, MN"
,,
7 Novice    Total Riders = 19    Groups = 3,,
,1,"HANNAH JAMESON, DARDEENE PRAIRIE, MO"
,2,"LOGAN (THE CAPTAIN) LEMMERS, PLATO, MN"
,3,"BENTLEY  (BOON) MUHLBACH, ANTIOCH CYCLERY, ANTIOCH, IL"
,4,"STILES SAVOIE, BMX4LIFE, LAKE ARTHUR, LA"
,5,"ERIKA WILKE, RACER ARMY, OCONOMOWOC, WI"
,6,"JACOB  ROGERS, TAHLEQUAH, OK"
,7,"HUDSON (ROOSTER) MILLER, CROSSROADS BMX RACING, UNION, KY"
,8,"WYATT (THE DISCIPLE) GAMBLIN, BETHALTO, IL"
,,
8 Novice    Total Riders = 17    Groups = 3,,
,1,"ARIAN  LOPEZ, EXHILE/BLACKCROWN, HOUSTON, TX"
,2,"JAYDON BENNETT, CRANDALL, TX"
,3,"MADISON THOMPSON, PRECISION BMX, MURRIETA, CA"
,4,"HUNTER HUGHES, OKLAHOMA CITY, OK"
,5,"KAYLA KEENER, NOXCUSES, WICHITA, KS"
,6,"CURTIS HEITDOTTEN JR, FLORISSANT, MO"
,7,"LIAM SHRIVER, OKLAHOMA CITY, OK"
,8,"JOSHUA  LESLIE , GLOSTER, LA"
,,
9 Novice    Total Riders = 20    Groups = 4,,
,1,"JOHN (JOHN_K__YARD) KENNEY IV, MOM&DAD SMART PARTY, NORTH HILLS, CA"
,2,"TYLER SOHL, LIBERTY BMX, LINCOLN, NE"
,3,"JAYSON KILLINGER, MULVANE, KS"
,4,"RAINA BENZ, RIDECO BIKE SHOP, COLORADO SPRINGS, CO"
,5,"COLLIN HUGHES, BIKES 4 THE LIKES OF US, O FALLON, MO"
,6,"GAGE SOHL, LIBERTY BMX, LINCOLN, NE"
,7,"MEILA (THE MONSTER) BOECKER, PRODIGY RACING, HAM LAKE, MN"
,8,"MARIAH (COOKIE MONSTER) OLIVER, TEAM YOLO, SAND SPRINGS, OK"
,,
10 Novice    Total Riders = 24    Groups = 4,,
,1,"KAYRIM MOHAMED, VAL-DES-MONTS, QC"
,2,"EVAN (WHEELS) STUCK, SHAKE N BAKE/ME, WARRENSBURG, MO"
,3,"CHARLES (CHARLIE) CLAVIN, NOKOMIS, IL"
,4,"JACOB KEOHI, F&S RACING, CARROLLTON, TX"
,5,"BROOKLYN  (KILLER B) MAGLIOLO , MEMPHIS, TN"
,6,"LUKE (CHAOS) HOLCOMB, GERMANTOWN, TN"
,7,"TYLA FARRIS, POUNDFOOLISH WATCHES, ALPINE, CA"
,8,"CHAE-LEE RINDT, BLACK WIDOW, SEDGWICK, KS"
,,
11 Novice    Total Riders = 21    Groups = 4,,
,1,"KYLIE (THE KRUSHER) WAGONER, BOMBSHELL DEVO TEAM, CANYON LAKE, CA"
,2,"PIPER BADRAUN, YESS, AURORA, CO"
,3,"CODY GRASS, PRYOR, OK"
,4,"GENTRY MAASEN, OAK GROVE, MO"
,5,"DONOVAN KIRK, OMAHA, NE"
,6,"KAIDEN (RAIDEN) DUBOIS, QUICKDRAW COFFEE, SAN ANTONIO, TX"
,7,"CASEY RHODUS, HOSTILE BMX, OZARK, MO"
,8,"DANE (STRYKER) PADILLA, ALBUQUERQUE, NM"
,,
12 Novice    Total Riders = 16    Groups = 3,,
,1,"JACK JAFFE, T1 BMX RACING TEAM, COUNCIL BLUFFS, IA"
,2,"TRISTAN DICKEY, AUSTIN, TX"
,3,"SYLVIA CALABRESE, UNIVERSAL COATINGS, PASADENA, MD"
,4,"KADEN HEIDOTTEN, FLORISSANT, MO"
,5,"COOPER (BIG BOY) BRYSON, MOM AND DAD, DALTON, GA"
,6,"TIERRA (T-REX) NELSON, SPERRY, OK"
,7,"BRADY DOBBINS, KANSAS CITY, MO"
,8,"TRAVIS CURTIS, RIOT, MILACA, MN"
,,
13 Novice    Total Riders = 15    Groups = 3,,
,1,"BRYCE HURD, LENAPAH, OK"
,2,"KYLE HAMMACK, BEDFORD, TX"
,3,"DONTAY BROWN, MAJESTY RACE, BUCKNER, MO"
,4,"TYLER (THE HITMAN) WHIMLEY, KANSAS CITY, MO"
,5,"KAUAN SILVA, BIKES FOR THE LIKES OF, OVERLAND PARK, KS"
,6,"JACOB BARAN, JENKS, OK"
,7,"HOPE MONTGOMERY, GIRL POWER, LOMA, CO"
,8,"CARTER HESTER, PREMIER RACING, HEATH, TX"
,,
14 Novice    Total Riders = 11    Groups = 2,,
,1,"ANDREW DAVIS, ZERO GRAVITY/TELGE ROOFING, SPRING, TX"
,2,"JACK WOLFF, STEPHENVILLE, TX"
,3,"JACOB MATLOCK, ITALY, TX"
,4,"COLE MCGHAHEY, KAOS TEXAS, FORT WORTH, TX"
,5,"RYLAN FRANKLIN, CORSICANA, TX"
,6,"ELLIE HOWARD, BIKES FOR THE LIKES OF U, TOPEKA, KS"
,7,"ETHAN YOUNG, SPEEDSTERZ, ODI, BEAUMONT, CA"
,8,"TRINITY PERRY, EXILE RACING, HOUSTON, TX"
,,
15 Novice    Total Riders = 10    Groups = 2,,
,1,"JEFFREY WOLFF, STEPHENVILLE, TX"
,2,"JAMIE (JAMIE) OWNBEY, WICHITA OLD SCHOOL BMX, ANDOVER, KS"
,3,"DRU STEPHENS, MADISON, MS"
,4,"CADENCE (SWEET BABY) ROSAS, MAKE READY, LAS VEGAS, NV"
,5,"JACE MCCLURE, SAND SPRINGS, OK"
,6,"ASHLEY ROLLICK, GET-A-GRIP, MANASSAS, VA"
,7,"JOSH SYMANIETZ, SSQUARED MN, SAINT CLOUD, MN"
,8,"XAVIER LOMELI, BULLHEAD CITY, AZ"
,,
16 Novice    Total Riders = 5    Groups = 1,,
,1,"COLIN (SCHMIDTY) SCHMIDT, WICHITA, KS"
,2,"LANDON KING, PEDALING INNOVATIONS, LONGVIEW, TX"
,3,"CHRISTOPHER WORTHINGTON, INDY4130, INDIANAPOLIS, IN"
,4,"BRIDGETTE CAULFIELD, FLY ZONE RACING, BARRINGTON, IL"
,,
17-20 Novice    Total Riders = 6    Groups = 1,,
,1,"JACK HEABERLIN, CAVEMAN RACING, TULSA, OK"
,2,"IAN SOLANO, FLORENCE, CO"
,3,"ALISEA JACKSON, MOUNT MORRIS, MI"
,4,"MASON MAYO, KAOS TEXAS, FORT WORTH, TX"
,5,"JAKE (THE CAPTAIN) BENNETT, TEAM COOKED, GREENCASTLE, IN"
,,
21-25 Novice    Total Riders = 5    Groups = 1,,
,1,"SHEA  DIEDRICK, YUKON, OK"
,2,"AUSTIN GOMES, LINDENWOOD UNIVERSITY, FLORISSANT, MO"
,3,"MADISON SNYDER, CHICKASHA, OK"
,4,"THOMAS SOTO, LRC MONGOOSE SQUAD, ADRIAN, MI"
,,
26-35 Novice    Total Riders = 11    Groups = 2,,
,1,"DEVIN OLSON, BLACK WIDOW KANSAS, EL DORADO, KS"
,2,"CHASE PITTMON, FORNEY, TX"
,3,"DAVID GILL, LAKE HAVASU CITY, AZ"
,4,"MATTHEW DEGROOT, DYNAMITE NATION, VALLEJO, CA"
,5,"JOE MCCLINTOCK, BELIEVE RACE TEAM, O FALLON, MO"
,6,"ASHLYN GOLDSMITH, KEGELS BIKE SHOP, PECATONICA, IL"
,7,"KEVIN SNIDER, TULSA, OK"
,8,"HUNTER GALLOWAY, BIXBY, OK"
,,
36-40 Novice    Total Riders = 14    Groups = 2,,
,1,"ADAM BENCZO, SUPER DUPER BIKE SHOP, IRWIN, PA"
,2,"ADAM THUL, FAT KID RACING, MANKATO, MN"
,3,"SEAN GODINEZ, EXILE RACING, BACLIFF, TX"
,4,"KYLE DENNY, COLLINSVILLE, OK"
,5,"NIC BEXTERMUELLER, SRT, SAINT PETERS, MO"
,6,"DAVID OTTAVIANO, VOORHEES, NJ"
,7,"BRUCE DAY, CANTON, GA"
,8,"LANCE (BIG DADDY) GUNTER, RAD RACING, OKLAHOMA CITY, OK"
,,
41-45 Novice    Total Riders = 17    Groups = 3,,
,1,"TYRONE PINNOY, FAITH USA, SPRING, TX"
,2,"MICHAEL CRANFILL, LANDSTAR RACING, VALLEYBROOK, OK"
,3,"GREGORY SHREEVE, IRONMAN'S ARMY, PHOENIX, AZ"
,4,"RANCE GREER, DESOTO, TX"
,5,"TRAVIS WILSON, NORMAN, OK"
,6,"CHRISTOPHER (BRICK) KEMP, INDY 4130, MORGANTOWN, IN"
,7,"MATT HUBBARD, BISMARCK, ND"
,8,"MICHAEL CROW, NOKOMIS, IL"
,,
46-50 Novice    Total Riders = 18    Groups = 3,,
,1,"MURIZ ALICAJIC, WESTMINSTER, CA"
,2,"DAVID PERMUY, BIKE BOSS, CHANDLER, AZ"
,3,"MATTHEW ROY, JBR-JOHNSON'S BMX RACING, BROUSSARD, LA"
,4,"BRIAN STEELE, CARPE' DIEM RACING, GEORGIA, GA"
,5,"ELI (ELZILLA) RENDON, BMX GOONIES, BURBANK, CA"
,6,"RONNIE WALLACE, SPLENDORA, TX"
,7,"DENNIS GAYLER, GAYLER BUILDING CO., TRACY, CA"
,8,"CHARLIE SALISBURY, ROCK CITY BMX, PIERSON, MI"
,,
51 & Over Novice    Total Riders = 21    Groups = 4,,
,1,"MARK PADILLA, ALBUQUERQUE, NM"
,2,"DOMINIC CELLITTI, HOUSTON, TX"
,3,"DAVID MAYO, KAOS TEXAS, FORT WORTH, TX"
,4,"RICHARD MCAVANEY, YUMA, AZ"
,5,"BRAD (LL COOL J) JENNINGS, FORT COLLINS, CO"
,6,"MARC FRITZMEIER, BLACK WIDOW, ROCHESTER, MN"
,7,"CHRISTOPHER WORTHINGTON, INDY4130, INDIANAPOLIS, IN"
,8,"BRIAN (COWBOY) STRAIN, STRAIN RANCH /  LIBERTY, HIGHALNDVILLE, MO"
,,
5 & Under Intermediate    Total Riders = 20    Groups = 4,,
,1,"TYLER (FLASH) GUDELJ, MOM & DAD, PLACITAS, NM"
,2,"ELI (DOZER) MCQUAIG, MCQUAIG RACING, NAPANEE, ON"
,3,"CALEB GASSAWAY, AKRON, NY"
,4,"TITUS (T-REX) HARRIS, BMXTC, NAMPA, ID"
,5,"LIAM (THE BIRDMAN) KOVACS, F&S RACING, RED OAK, TX"
,6,"CRUISER BROUGHTON, RAD DUDES, SMYRNA, GA"
,7,"ASHER FULTON, BRAHAM, MN"
,8,"JACOB (KAMIKAZE) COLWELL, LBX RACINIG, QUEEN CREEK, AZ"
,,
6 Intermediate    Total Riders = 34    Groups = 6,,
,1,"JASON DENEA, ORCHARD PARK, NY"
,2,"RYDER (THE MACHINE) JOHNSON, JBR-JOHNSON'S BMX RACING, EUNICE, LA"
,3,"TANNER FARLEY, GRAND JUNCTION, CO"
,4,"LUCAS RYAN, BOMBSHELL, ALBUQUERQUE, NM"
,5,"CARLOS LOPEZ, MISBEEHAVIN, SAN DIEGO, CA"
,6,"RAMSEY (LIGHTING) CHADWICK, RIDECO, DENVER, CO"
,7,"KESTON (SKITTLES) THORNGREN, MAX SPEED RACING, IDAHO FALLS, ID"
,8,"KRISTOPHER (KP) MEINEL, TNT CONNECTICUT, MONROE, CT"
,,
7 Intermediate    Total Riders = 43    Groups = 8,,
,1,"TRISTAN JANSSENS, REDMAN JR. DEVO, PERRIS, CA"
,2,"GRAHAM MICHAELIS, SSQUARED MINNESOTA, PAYNESVILLE, MN"
,3,"SPENCER REAUX, CLAYBORN BICYCLES, WALKER, LA"
,4,"ANTHONY AGRAAN, TUCSON BMX TEAM, TUCSON, AZ"
,5,"TEGAN NOTEWARE, MOM AND DAD, EAGLE, CO"
,6,"ESTEBAN MORALES, DL BMX, SARASOTA, FL"
,7,"COLE NOLTE, KEVINS PRO PAINTING, PEORIA, AZ"
,8,"ZAYDEN DAVID, JUST FOR FUN BMX, IONIA, MI"
,,
8 Intermediate    Total Riders = 50    Groups = 9,,
,1,"COOPER JOACHIM, BLACK CROWN NOLA, BILOXI, MS"
,2,"DEEGAN FRIESEN, BAKERSFIELD, CA"
,3,"WESLEY MINERY, BMX BRIGADE, FAIRBORN, OH"
,4,"CULLEN MEURLOT, FORSYTH, IL"
,5,"PARKER MURRAY, TNT, MAYS LANDING, NJ"
,6,"CAMERON WARNER, DYNAMITE NATION, PIONEER, CA"
,7,"CROSBY BACKER, RED OAK, TX"
,8,"NOAH (NINJA) TENA, BOMBSHELL, BAKERSFIELD, CA"
,,
9 Intermediate    Total Riders = 54    Groups = 9,,
,1,"BRODY VERDUZCO, GORDY'S BICYCLES, PEORIA, AZ"
,2,"GAVIN (TURBO) THOMAS, IRONMAN BMX ARMY, SCOTTSDALE, AZ"
,3,"DEACON LARSON, COLORADO SPRINGS, CO"
,4,"JOE CANTINO, ALPHA DEVELOPMENT, LEVITTOWN, NY"
,5,"ALFREDO MARTINEZ, JET RACING, FERNLEY, NV"
,6,"TYLER (MOHAWK MACHINE) MARTIN, IRON CITY BIKES, MONONGAHELA, PA"
,7,"HOLDEN MURPHY, SARASOTA BMX ACADEMY, PARRISH, FL"
,8,"TRIGGER MARTIN, FULLY COMMITTED, EROS, LA"
,,
10 Intermediate    Total Riders = 30    Groups = 5,,
,1,"GUNNAR SCHAUB, GYPSUM, CO"
,2,"EMILEE WELLS, BICYCLE-X-CHANGE, WICHITA, KS"
,3,"GABRIEL (PAC MAN) OLIVAS, BROKEN SPOKE, SANTA FE, NM"
,4,"BLAISE (THE BLAISER) LUCAS, BOMBSHELL/ORCA, MURRIETA, CA"
,5,"MAXIMUS (MAX SPEED) MENTAL, FLORIDA ANSWER SSQUARED, WESTON, FL"
,6,"DAX (THE ROCKET) ROCKEY, CAVEMAN, YUKON, OK"
,7,"ASHER BLUM, MOTORCYCLE CLOSEOUTS, INDEPENDENCE, MO"
,8,"LOGAN HUNT, YOUNG GUNS, VALPARAISO, IN"
,,
11 Intermediate    Total Riders = 34    Groups = 6,,
,1,"BRYCE PERMUY, PEAK PERFORMANCE, CHANDLER, AZ"
,2,"ELLIOT BARLOW, TEAM MISSBEEHAVIN, PHOENIX, AZ"
,3,"CASH STRICKLAND, VELOCITY BIKE CO., BIRMINGHAM, AL"
,4,"COOPER (FEARLESS J) JACKSON, 2ND GEN RACING, CARTHAGE, MO"
,5,"ELLIS WHEAT, PREMIER RACING, GARLAND, TX"
,6,"JACKSON MAGIE, BOMBSHELL, CONWAY, AR"
,7,"KAIDEN (KK) NAPIER, HOSTILE BMX, BATTLEFIELD, MO"
,8,"DANIEL (D-CAT) CATHEY, LIBERTY RACING, SPRINGFIELD, MO"
,,
12 Intermediate    Total Riders = 39    Groups = 7,,
,1,"NICHOLAS (NICHO) SANCHEZ, DLBMX, CM DESIGNS, JACKSONVILLE, FL"
,2,"RYDER HAJEK, ISRAEL RACING TEAM, LOS ANGELES, CA"
,3,"TAVIN (PRETZEL BOY) NOVELLY, SAINT PETERS, MO"
,4,"OWEN (THE O SHOW) HEATH, BREAKAWAY BICYCLES, NORTON SHORES, MI"
,5,"TAYLOR DEASON, RIOT, BRAINERD, MN"
,6,"MAREK BACKER, PREMIER RACING, MIDLOTHIAN, TX"
,7,"NOAH (NO WAY NOAH) GOMEZ, RIDECO, COLORADO SPRINGS, CO"
,8,"DEEGAN (LADIES MAN) BEACHNER, DYSFUNCTIONAL BMX, HARRISONVILLE, MO"
,,
13 Intermediate    Total Riders = 46    Groups = 8,,
,1,"MALAKIAH SMITH, THE BIKE MASTER, PORT ORCHARD, WA"
,2,"ANTON REIMER, BLUEGRASS ANSWER/SSQUARED, LOUISVILLE, KY"
,3,"PEYTON THEUNE, AZ BICYCLE WERXM&M PRINT, PEORIA, AZ"
,4,"BRADAN FORREST, DYNAMITE NATION, NAPA, CA"
,5,"NICHOLAS (NASTY NICK) GALLARDO, SWAT/SUPERCROSS, APPLE VALLEY, CA"
,6,"TRUMAN (TRUCKIN) WALLACE, CELESTIAL CYCLES, FOREST PARK, OK"
,7,"COOPER REEK, ODI SPEDDSTERZ, BEAUMONT, CA"
,8,"JADEN DUNN, WEATHERFORD, TX"
,,
14 Intermediate    Total Riders = 43    Groups = 8,,
,1,"PATRICK CARVAJAL, BOGOTA"
,2,"KAMREN KRICKLER, SHEPHERDSTOWN, WV"
,3,"MATTHEW MCGOWAN, RIOT, RICE, MN"
,4,"ALAN SMITH, SAN ANTONIO, TX"
,5,"KAIDEN MAURER, HOSTILE BMX, WILLARD, MO"
,6,"CODY WESALA, MINT PRINT MEDIA, PHELAN, CA"
,7,"DILON MORGAN, BOMBSHELL/100%/ODI, MURRIETA, CA"
,8,"TEEGAN HALE, CHOCTAW, OK"
,,
15 Intermediate    Total Riders = 21    Groups = 4,,
,1,"CAREY MCCREADY, YESS, BOULDER, CO"
,2,"DAMIAN SANDOVAL, BULLHEAD CITY, AZ"
,3,"DALLAS (DALLYBRO) TOWNS, SSQUARED, DAVISON, MI"
,4,"OTTO (BIG G) GETZLOFF, MEGADIRT, WISCONSIN RAPIDS, WI"
,5,"ZANE (INSANE ZANE) KIRKLIN, LANDSTAR, PIEDMONT, OK"
,6,"MASON VOIGT, ST CLOUD, MN"
,7,"(SKETCHY) NICHOLAS OLIVAS, BROKEN SPOKE, SANTA FE, NM"
,8,"TOBIAS COLLINS, HOSTILE, FORSYTH, MO"
,,
16 Intermediate    Total Riders = 20    Groups = 4,,
,1,"SIMON MILLER, LAFAYETTE, LA"
,2,"JUAN GAVIRIA, JACKSONVILLE, FL"
,3,"DRAKE DOHERTY, BLACKSHEEP, BENTONVILLE, AR"
,4,"EVAN MCKEE, HASLET, TX"
,5,"NATHAN JONES, WEST COAST RACING, LAND O LAKES, FL"
,6,"ETHAN ADAMS, SUPER SQUIRREL BMX, CANTON, MS"
,7,"MITCHEAL EVANS, IONIA, MI"
,8,"DOMINICK DUENAS, RIO RANCHO, NM"
,,
17-20 Intermediate    Total Riders = 24    Groups = 4,,
,1,"KHRISTIAN KRICKLER, SHEPHERDSTOWN, WV"
,2,"IAN BEILFUSS, WEST COAST RACING, LUTZ, FL"
,3,"STOCKTON MOUNTEER, ALPHA DEVELOPMENT, GILBERT, AZ"
,4,"TRENTON STORM, GLORY IN MOTION, WEST MONROE, LA"
,5,"SAM (PSYCHO) FISCHER, UDDERLY MOOLICIOUS, SAINT PETERS, MO"
,6,"ALONZO SANDOVAL, BULLHEAD CITY, AZ"
,7,"CODY FINK, SHIRLEY, NY"
,8,"BRITT DOOLEY, ALABAMA’S FINEST GOONS, DEATSVILLE, AL"
,,
21-25 Intermediate    Total Riders = 5    Groups = 1,,
,1,"KYLE MOONEY, DIRT ADDICTION BMX, LAS VEGAS, NV"
,2,"NATHAN RILEY, SKIDMARK RACING, MIAMI, OK"
,3,"COLE MITCHELL, YOLO BMX, SAND SPRINGS, OK"
,4,"DAYTON ISAACS, BLACK WIDOW BMX, SAINT MICHAEL, MN"
,,
26-35 Intermediate    Total Riders = 28    Groups = 5,,
,1,"MICHAEL GRESHAM, ABMS, SEMINAL, OK"
,2,"SANTIAGO SOTO, LAS CRUCES, NM"
,3,"DUSTIN (TANK) LUCAS, AMERICAN SOLDIER NETWORK, AURORA, CO"
,4,"TY (THE BAYOU BULLET) JOHNSON, JBR-JOHNSON'S BMX RACING, EUNICE, LA"
,5,"TYLER SHUTTS, EXILE BLACK CROWN, KATY, TX"
,6,"GARRETT RUSSELL, DUH TEAM, WORDEN, IL"
,7,"JASON WARYAS, KBCO BMX, WATERFORD, MI"
,8,"RIGOBERTO (RIGO) SOLANO, ALPHA DEVELOPMENT, CITRUS HEIGHTS, CA"
,,
36-40 Intermediate    Total Riders = 30    Groups = 5,,
,1,"ROSS (THE BULL) BULLER, JUST CUZ RACING, RODEO, CA"
,2,"BRIAN (FROG) MANIS, MARY KAY, DALTON, GA"
,3,"ALDEN MILLER, TEAM ASCENSION, NAMPA, ID"
,4,"ANDY (NOT SO RADICAL) HUBBARD, LANDSTAR RACING, OKLAHOMA CITY, OK"
,5,"MARCELO (MARCELO) OLIVEIRA, BOSTON, MA"
,6,"ALEX SNELL, CYCLE WORKS, LINCOLN, NE"
,7,"BRANDON ALLWINE, IRONMANS BMX ARMY, SPRINGFIELD, MO"
,8,"JORGE JUAREZ, DIABLOS RACING, DALLAS, TX"
,,
41-45 Intermediate    Total Riders = 38    Groups = 7,,
,1,"TODD ROSENBERG, BEND, OR"
,2,"GUS RICHARD, LARSON CYCLERY, BISMARCK, ND"
,3,"CHRIS LANDSBERGER, LANDSTAR RACING, YUKON, OK"
,4,"GENE FARRIS, POUNDFOOLISH WATCHES, ALPINE, CA"
,5,"RICHIE BOWKETT, CROSSFIT IRON FORT, BRADFORD"
,6,"LUKE (COOL HAND LUKE) ANDERSON, ANTIOCH CYCLERY, LAKE VILLA, IL"
,7,"THOMAS (TOMMY) MILLER, PREMIER RACING, THE COLONY, TX"
,8,"PAUL DEMATTEO, KANSAS CITY, MO"
,,
46-50 Intermediate    Total Riders = 39    Groups = 7,,
,1,"TROY (THE RAGIN CAJUN) JOHNSON, JBR-JOHNSON'S BMX RACING, EUNICE, LA"
,2,"KELLY BLANKENSHIP, INDEPENDENT ALL STAR, FORT WORTH, TX"
,3,"ROBERT TANNER, FLIGHT BMX, LAKE HAVASU CITY, AZ"
,4,"JAYMES WELCH, PERRIS, CA"
,5,"JAMES (SQUIRREL) STEVENSON, ROGERS, AR"
,6,"FABIAN TOUZET, PARIS"
,7,"CLINT ARNOLD, LEAGUE CITY, TX"
,8,"ROBERT BANE, NO EXCUSE SSQUARED ODI, RIVERSIDE, CA"
,,
51 & Over Intermediate    Total Riders = 30    Groups = 5,,
,1,"ALBERT HARNDEN, GT BMX, ORANGE, CA"
,2,"JIM GARRETT, BIKE ALLEY, DOWNEY, CA"
,3,"CHRIS BLACKBURN, CW RACING, ALEXANDRIA, VA"
,4,"DAVID KOCH, WALNUT SHADE, MO"
,5,"FRANK (BIG HURT) BRANUM, WHEELER DEALER BIKE SHOP, MUNFORD, TN"
,6,"SHAWN MORRIS, HOSTILE NORTHEAST, SCOTIA, NY"
,7,"MICHAEL (MAGIC MIKE) BERGMAN, BULLSEYE CYCLE, WAUKESHA, WI"
,8,"WILLIAM YAGER, LITTLE ROCK, AR"
,,
5 & Under Expert Girls    Total Riders = 13    Groups = 2,,
,1,"KIRA VESCUSO, FACTORY BOMBSHELL, RIO RANCHO, NM"
,2,"PEYTON SPANEL, UNION RIDECO, BAKERSFIELD, CA"
,3,"SAMANTHA RATZLAFF, ALPHA DEVELOPMENT, LA HABRA, CA"
,4,"ELINOR CHRISTENSEN, ONE TRACK MIND, KINGSTON, WA"
,5,"CHRISTINA BISKUPSKI, RIDE LIKE A GIRL NJ, BRICK, NJ"
,6,"CAMISON PYPER, HRP DESIGNS, BESSEMER, AL"
,7,"AMELIA DOWDY, GET-A-GRIP, STAFFORD, VA"
,8,"KEILANI GRAY, WIKID RACING, TALLMADGE, OH"
,,
6 Expert Girls    Total Riders = 10    Groups = 2,,
,1,"MADDIE BAIRD, WIAWIS/LSG, HESPERIA, CA"
,2,"PEYTON BRUNEY, RIDE LIKE A GIRL/DANS COMP, PITTSBURGH, PA"
,3,"GERI HOLLINGSWORTH, FACTORY LRC/MONGOOSE, HENDERSON, NV"
,4,"MALIA (CRANKS) ALVAREZ, REAL TIME BMX, BLOOMINGTON, IL"
,5,"SAWYER (BLEU) SMITH, FLORIDA ANSWER SSQUARED, LONGWOOD, FL"
,6,"CALI KOPETSKIE, VELOCITY BIKE CO, BURLINGTON, NC"
,7,"MARILYN (BABY FOX) MARTINEZ, RAD DUDES, GRETNA, LA"
,8,"CECELIE (CECE) DOMINGUEZ, FIRST GENERATION BMX, SAN ANTONIO, TX"
,,
7 Expert Girls    Total Riders = 16    Groups = 3,,
,1,"OLIVIA ALVIDREZ, BMX SHARKS, MORENO VALLEY, CA"
,2,"JEMMA (LIL JT) TOLLEFSON, FACTORY BOX COMPONENTS, WOODBURY, MN"
,3,"MAYA GADBOIS, NO XCUSES ANSWER BMX, SANTA CLARITA, CA"
,4,"SEQUOIA GOMOLICKE, BAY AREA BMXERS, UKIAH, CA"
,5,"ALEXANDRIA PASOWICZ, POWERLITE-DANSCOMP-DFR, LA VERNE, CA"
,6,"ZOEY (ZO BOOGIE) BARNES, IMPACT BMX RACING, LAS VEGAS, NV"
,7,"TAYLOR DURFEE, UPRIGHT/URBAN GRAVITY, BEND, OR"
,8,"CALLIA (CLOSER CALLIE) KOUTRIS, PRODIGY RACING, MAPLE GROVE, MN"
,,
8 Expert Girls    Total Riders = 21    Groups = 4,,
,1,"RYLEN BAYLY, WIAWIS/LSG, THORTON, CO"
,2,"KENNEDY KNOPP, FACTORY FULL TILT/RADIO, SPOKANE VALLEY, WA"
,3,"DANICA APPENZELLER, DUKE CITY DEVELOPMENT, ALBUQUERQUE, NM"
,4,"HARPER VESCUSO, FACTORY BOMBSHELL, RIO RANCHO, NM"
,5,"BROOKE (CRAZY BROOKE) WALSKI, CLAYBORN/ANSWER FACTORY, BAKERSFIELD, CA"
,6,"CHASE BURIAN, ALPHA DEVELOPMENT, BOZEMAN, MT"
,7,"LEAH HOLMES, FACTORY REMIX, FERNLEY, NV"
,8,"NATALIA (THE FLASH) KOVACS, F&S RACING, RED OAK, TX"
,,
9 Expert Girls    Total Riders = 21    Groups = 4,,
,1,"PIPER GRAATEN, FACTORY YESS, LANTZVILLE, BC"
,2,"LANDON BURIAN, ALPHA DEVELOPMENT, BOZEMAN, MT"
,3,"KAITLYN VAN RENSELAAR, VELOCITY, WEST JORDAN, UT"
,4,"JORDAN TAYLOR, DYNAMITE NATION, BONNEY LAKE, WA"
,5,"QUINN REILING, FACTORY ORCA BOMBSHELL, STRATHCONA COUNTY, AB"
,6,"ISABELLA STEVENS, FACTORY SSQUARED, NEENAH, WI"
,7,"JENNA (MILLER-TIME) MILLER, FACTORY REMIX, SAUGERTIES, NY"
,8,"SHANYIA (LIL BOSSY) REESE, RBR/RIFT/FLY/BOMBSHELL, PORTLAND, OR"
,,
10 Expert Girls    Total Riders = 27    Groups = 5,,
,1,"ZOE (THE Z) DANNENBERG, RIVAL RACING, NICHOLASVILLE, KY"
,2,"NORA WILLMERT, WIAWIS/LSG, CAMBRIDGE, MN"
,3,"LILY (TIGERLILY) HINTON, POWERLITE-DANSCOMP-DFR, BROOKFIELD, IL"
,4,"PRESLIE (PISTON) GOULD, IMPACT BMX RACING, HENDERSON, NV"
,5,"KATE CLARRIDGE, RIDE LIKE A GIRL/DANS COMP, MARYSVILLE, OH"
,6,"(KICKIN) KENADIE  NEELAN, LETHAL/SPEEDCO, BRAINERD, MN"
,7,"TAYLOR LEAKEY, ARIZONA BICYCLE WERX/FALL RISK RACING, PHOENIX, AZ"
,8,"MIA CUSTER, FACTORY BLACKCROWN BMX, BRIDGETON, NJ"
,,
11 Expert Girls    Total Riders = 31    Groups = 6,,
,1,"SOPHIA (SOPHAST) RODRIGUEZ, FACTORY YESS, BEND, OR"
,2,"LOLA JONJEVIC, POWERLITE-DANSCOMP-DFR, KANSAS CITY, MO"
,3,"RYLEIGH (THE ROCKET) HERRERA, VELOCITY BIKE CO, HERRIMAN, UT"
,4,"EMMA (BEAST MODE) CAVNER, ALBES, ROCKFORD, MI"
,5,"AVERY (ARN2465927) JONES, POWER FX SPEED CO., CAPE CORAL, FL"
,6,"BREEANNE VAUGHAN, FACTORY BOMBSHELL/AVENT, WALNUT, CA"
,7,"KRISTA HOPKINS, RACEFAST, CLOVIS, CA"
,8,"TESS BAILEY, WIAWIS/LSG, LAKE TAPPS, WA"
,,
12 Expert Girls    Total Riders = 27    Groups = 5,,
,1,"NICOLE FORONDA, BAY AREA BMXERS, MEDELLIN"
,2,"ALEXIS ALDEN, JR BICYCLES.COM/SPEEDCO/AVIAN, PEACHTREE CITY, GA"
,3,"LILY GREENOUGH, PURE BICYCLES, CAMBRIDGE"
,4,"DANICA (LIL AVALANCHE)ANDERSON, LANCASTER, CA"
,5,"BAILEY CATT, 316 RACING, DULZURA, CA"
,6,"AVERY CHARTRAND, WIAWIS/LSG, ISANTI, MN"
,7,"HANNAH LEAKEY, ARIZONA BICYCLE WERX/FALL RISK RACING, PHOENIX, AZ"
,8,"KYLEE NIEDERBERGER, FACTORY ANSWER, JARRETTSVILLE, MD"
,,
13 Expert Girls    Total Riders = 34    Groups = 6,,
,1,"GRECIA CRISTODULO, FACTORY SSQUARED, DALLAS, TX"
,2,"RITA FEDEWA, FCR, FT COLLINS, CO"
,3,"SYDNEY GARONZIK, DAYLIGHT CYCLES, LAKE TAPPS, WA"
,4,"ISABELLA (PACMAN) NELSON, MOM & DAD, SUFFIELD, CT"
,5,"STELLA (SLING SHOT) SUNSERI, JR BICYCLES.COM/SPEEDCO/AVIAN, SAN JOSE, CA"
,6,"MIKAYLEE (YA YA) RAMSEY, VELOCITY BIKE CO, CLIFTON, CO"
,7,"JENA (PRINCESS) VONHOLZEN, FACTORY MIDWEST PULL, OSHKOSH, WI"
,8,"REESE GEISTER, ALTO, MI"
,,
14 Expert Girls    Total Riders = 35    Groups = 6,,
,1,"ANNABELLA (BELLA!!) HAMMONDS, SUPERCROSS BMX, APPLE VALLEY, CA"
,2,"JACY MOORE, WIAWIS/LSG, PORT ORCHARD, WA"
,3,"JORDYN (THE RYTHYM) MIRANDA, BMX SHARKS, MOHAVE VALLEY, AZ"
,4,"BREANNA (MONSTER B) WINTER, FACTORY RIFT CANADA, ANTELOPE, CA"
,5,"CHLOE KAPPEN, FACTORY ANSWER, PHOENIXVILLE, PA"
,6,"MANUELA MUNOZ VELEZ, FACTORY YESS BMX, CUTLER BAY, FL"
,7,"KIRA BOUSTEAD, NVP/MACHINE TRAINING, VALLEJO, CA"
,8,"SIERRA (THE DOORSLAMMER) SAMHAMMER, FACTORY REMIX, MEDFORD, OR"
,,
15-16 Expert Girls    Total Riders = 48    Groups = 8,,
,1,"TEIGEN PASCUAL, FACTORY RIFT CANADA, GARIBALDI HIGHLANDS, BC"
,2,"MOLLY SIMPSON, DAYLIGHT CYCLES, RED DEER, AB"
,3,"ESJA SHRIVER, BAY AREA BMXERS, LAKEWOOD, CA"
,4,"NENEKA NISHIMURA, TEAM GANTRIGGER, OSAKA"
,5,"VALENTINA DAVALOS, WAXHAW, NC"
,6,"BROOKE CRAFT, FACTORY HARO, LAKESIDE, CA"
,7,"TRINADEE STOFLET, MIDWEST PULL, GARLAND, TX"
,8,"SIERRA ALTENDORF, NONE, EVERETT, WA"
,,
17-20 Expert Women    Total Riders = 37    Groups = 7,,
,1,"PAYTON (P-NUT) RIDENOUR, HARO, POTTSTOWN, PA"
,2,"OLIVIA ARMSTRONG, FACTORY FULL TILT/RADIO, BEND, OR"
,3,"MCKENZIE GAYHEART, FACTORY FULL TILT/RADIO, FORT WHITE, FL"
,4,"ASHLEY HAYES, RIDE CO/V3 GATE/SUPERCROSS, COLORADO SPRINGS, CO"
,5,"DALENY VAUGHN, REDMAN / FLY, TUCSON, AZ"
,6,"JAYCIE SINCLAIR, WIAWIS/LSG, SPRING, TX"
,7,"BAILEY BRANNEN, FACTORY ANSWER, DUNEDIN, FL"
,8,"CARLY KANE, DK BICYCLES, GUILFORD, IN"
,,
21-30 Expert Women    Total Riders = 19    Groups = 3,,
,1,"KAITLYN LARSON, BLACK WIDOW BMX, STACY, MN"
,2,"BAYLIE KORTMAN, TUSTIN, CA"
,3,"ERIN JONES, LANDSTAR RACING, TULSA, OK"
,4,"LEXIE ALEJANDRE, ARIZONA BICYCLE WERX/FALL RISK RACING, GLENDALE, AZ"
,5,"MIKA KORTMAN, TUSTIN, CA"
,6,"JENA (JAMMIN) SAGENDORF, PHOENIX, AZ"
,7,"EMILY MUNDAHL, STAATS, BISMARCK, ND"
,8,"JESSICA JAYNE, BLOTOUT GRAPHICS, EAST MORICHES, NY"
,,
31-40 Expert Women    Total Riders = 11    Groups = 2,,
,1,"ASHLEE HILL PETTINELLI, ALLTOW WRECKING CREW/YESS, SLINGERLANDS, NY"
,2,"KELLEY CHANDLER, BOMBSHELL, TUCSON, AZ"
,3,"CHRISTINA GAYLER, LANDSTAR RACING, DEL CITY, OK"
,4,"KRYSTAL ROBINSON, RACE INC, PENDLETON, IN"
,5,"LISA (LIGHTING LEGGS) WEBB, 1-800 KAOS, QUEENSTOWN, MD"
,6,"DANIELA CIFUENTES, CHIP-N-DALE, MOUNT HOLLY, NJ"
,7,"STEFANIE BLACKBURN, WARPED BMX, GRANBY, CT"
,8,"JENN RIST, BIKE DOCTOR, CROWNSVILLE, MD"
,,
41 & Over Expert Women    Total Riders = 12    Groups = 2,,
,1,"CHRISSY PIPER, JAWBREAKER, LOS ANGELES, CA"
,2,"HIDI CRAMER, GUNSLINGER FACTORY/ONEAL/ERA3, DES MOINES, WA"
,3,"SUSIE LEVAN, TNT BICYCLES FACTORY, NORTH PLAINFIELD, NJ"
,4,"NEVEN STEINMETZ, ARIZONA BICYCLE WERX/FALL RISK RACING, LAFAYETTE, CO"
,5,"SHEILA (SHE-RA) KAUPPI, PRODIGY RACING, EAST BETHEL, MN"
,6,"SHANNON ""SINGING"" SILVA, NASHVILLE, TN"
,7,"BECKY MOHR, MOHR COFFEE, LAKE HAVASU CITY, AZ"
,8,"MARJORIE (MAMA MARGE) KAMINSKI, STYLIN, EDEN, NY"
,,
5 & Under Expert    Total Riders = 5    Groups = 1,,
,1,"DANIEL (THE WARPATH) JOHNSON, LBX RACING, APACHE JUNCTION, AZ"
,2,"JOHN KERR, POWERLITE/DANS COMP/DFR, RIVERSIDE, CA"
,3,"EZRA (MOTO SLAYER) COSTA, GT, UPLAND, CA"
,4,"REID AUTRY, SSQUARED SOUTHEAST, GALLATIN, TN"
,,
6 Expert    Total Riders = 30    Groups = 5,,
,1,"JAXSON HOWELL, BMX SHARKS, HENDERSON, NV"
,2,"GREYSON (THE BULLET) SNEED, UNION RYDE CO, BAKERSFIELD, CA"
,3,"JACOB LACHOWICZ, TACKLEBOX RACING, CLARKSVILLE, TN"
,4,"CLYDE (THE SLIDE) SANTOS, FAITH RACE USA, LANCASTER, PA"
,5,"JACKSON STAUFFER, BLACK WIDOW BMX, FARIBAULT, MN"
,6,"CALSO JAMES, #FACTORY, BAKERSFIELD, CA"
,7,"ASHTON (BIG TEXAN) HESTER, PREMIER RACING, HEATH, TX"
,8,"JACKSON (ALL ACTION) SCOGGINS, SSQUARED SOUTHEAST, MEMPHIS, TN"
,,
7 Expert    Total Riders = 40    Groups = 7,,
,1,"WYATT (FIREBALL) WILLIAMS, REDMAN JR DEVO, LAKE ELSINORE, CA"
,2,"KNOX (THE OX) PERKINS, MIDVALE, UT"
,3,"JONAH KNOROWSKI, WIAWIS/LSG, PHOENIX, AZ"
,4,"WYATT (WY-FI) CHRISTENSEN, FACTORY ORCA BOMBSHELL, KINGSTON, WA"
,5,"JACOB THEISEN, SAINT CLOUD, MN"
,6,"JAGGER SEIMEARS, C.O.B., LAS VEGAS, NV"
,7,"CULLEN FUSSELL, SSQUARED SOUTHEAST, DOTHAN, AL"
,8,"MARSHALL (THE KID) WARNER, FACTORY FREE AGENT-BOX, SMITHSBURG, MD"
,,
8 Expert    Total Riders = 56    Groups = 10,,
