2019 Grand National,,
A Pro    Total Riders = 38    Groups = 15,,
,1,"JAYCE CUNNING, SPEEDCO/AVIAN, BARINGA, QLD"
,2,"ANTHONY BUCARDO, ALPHA, CANYON COUNTRY, CA"
,3,"TYLER KLUMPER, JR BICYCLES.COM/SPEEDCO/AVIAN, TARPON SPRINGS, FL"
,4,"ROGERIO (REIS) DOS REIS, CYPRESS FLOORING, ORLANDO, FL"
,5,"THOMAS ZULA, DK BICYCLES, DAYTON, OH"
,6,"MATEO MARASAS, LINDSEY WILSON COLLEGE, COLUMBIA, KY"
,7,"FLORIAN LEFEBVRE, NOLOGO/SPAD BMX, PARIS"
,8,"JUSTIN KNAPPER, FACTORY ANSWER, POTTSTOWN, PA"
,,
Vet Pro    Total Riders = 29    Groups = 12,,
,1,"EWERTON CARNEIRO, MURIAER, MG"
,2,"TYLER BROWN, 316 RACING DK BIKES, CHULA VISTA, CA"
,3,"JONATHAN SUAREZ, ALPHA, CORAL SPRINGS, FL"
,4,"JOSH SMITH, DK BICYCLES/CORSA, SPRINGBORO, OH"
,5,"MICKAEL LECANN, BC CRANGEURIER/IMPULSE GOODMAN, ARGONAY"
,6,"DYLAN SHANKS, NORTHWEST BMX/CORSA RACEWEAR, BEND, OR"
,7,"JUSTIN (MCSHITALK) MCLINTOCK, HINGE/NIGHT TRIPS, HUNTINGTON BEACH, CA"
,8,"JAMES CARTER, CLAYBORN/ANSWER FACTORY, GREENVILLE, WI"
,,
Women Junior    Total Riders = 8    Groups = 1,,
,1,"PAYTON (P-NUT) RIDENOUR, HARO, POTTSTOWN, PA"
,2,"ASHLEY HAYES, RIDE CO/V3 GATE/SUPERCROSS, COLORADO SPRINGS, CO"
,3,"MOLLY SIMPSON, DAYLIGHT CYCLES, RED DEER, AB"
,4,"CARLY KANE, DK BICYCLES, GUILFORD, IN"
,5,"DALENY VAUGHN, REDMAN / FLY, TUCSON, AZ"
,6,"NATALEE DAUGHERTY, FREE AGENT, MELISSA, TX"
,7,"VIOLET CEJALVO, SURREY, BC"
,8,"AKI SAKAI, DEUXROUES ELITE TEAM, OSAKA"
,,
Women Elite    Total Riders = 16    Groups = 6,,
,1,"ALISE WILLOUGHBY, FACTORY FULL TILT/RADIO, CHULA VISTA, CA"
,2,"ASHLEY VERHAGEN, FACTORY FULL TILT/RADIO, PHOENIX, AZ"
,3,"FELICIA STANCIL, SUPERCROSS BMX, INDIANAPOLIS, IN"
,4,"LAUREN REYNOLDS, FACTORY ANSWER, SAN DIEGO, CA"
,5,"BROOKE CRAIN, VISALIA, CA"
,6,"MIKAELA LIXANDRU, JR BICYCLES.COM/SPEEDCO/AVIAN, PHOENIX, AZ"
,7,"RACHEL MYDOCK, FACTORY REMIX, PHOENIX, AZ"
,8,"RACHEL JONES, FACTORY REMIX, CAMERON PARK, NSW"
,,
Men Junior    Total Riders = 26    Groups = 12,,
,1,"CAMERON WOOD, ALPHA, PEORIA, AZ"
,2,"GONZALO RENGEL, JR BICYCLES.COM/SPEEDCO/AVIAN, QUEVEDO"
,3,"BRAYDEN (THE BULLET) KEMPEL, ALPHA, RAMSEY, MN"
,4,"TOMAS CORREA , ORLANDO, FL"
,5,"SPENCER COLE, DK BICYCLES, PALM HARBOR, FL"
,6,"VINCENTE CESAR GARCIA PINTO, FLORIDA ANSWER SSQUARED, SAU PAULO, SP"
,7,"IAGO MACHADO, SAO LEOPOLDO, RS"
,8,"PATRICK COO, RACEFAST, BELLFLOWER, CA"
,,
Men Elite    Total Riders = 26    Groups = 12,,
,1,"CORBEN SHARRAH, DAYLIGHT CYCLES, TUCSON, AZ"
,2,"CONNOR FIELDS, CHASE BMX / ELEVN / IKON, HENDERSON, NV"
,3,"ROMAIN MAYET, PRIDE/NOLOGO, PARIS"
,4,"JEREMY RENCUREL, PERSAN"
,5,"JEFFERY UPSHAW, DAYTON, OH"
,6,"ROMAIN MAHIEU, LYON"
,7,"ALFREDO CAMPO, HUNTERSVILLE, NC"
,8,"NICHOLAS LONG, LAKESIDE, CA"
,,
6 & Under Mixed Open    Total Riders = 34    Groups = 6,,
,1,"MADDIE BAIRD, WIAWIS/LSG, HESPERIA, CA"
,2,"JOSHUA HARDIE, FAITH RACE USA, SPRING, TX"
,3,"RYDER (THE MACHINE) JOHNSON, JBR-JOHNSON'S BMX RACING, EUNICE, LA"
,4,"JASON DENEA, ORCHARD PARK, NY"
,5,"KESTON (SKITTLES) THORNGREN, MAX SPEED RACING, IDAHO FALLS, ID"
,6,"TYLER (FLASH) GUDELJ, MOM & DAD, PLACITAS, NM"
,7,"CALI KOPETSKIE, VELOCITY BIKE CO, BURLINGTON, NC"
,8,"CALEB GASSAWAY, AKRON, NY"
,,
7-8 Mixed Open    Total Riders = 56    Groups = 10,,
,1,"BROOKE (CRAZY BROOKE) WALSKI, CLAYBORN/ANSWER FACTORY, BAKERSFIELD, CA"
,2,"KENNEDY KNOPP, FACTORY FULL TILT/RADIO, SPOKANE VALLEY, WA"
,3,"RYLEN BAYLY, WIAWIS/LSG, THORTON, CO"
,4,"LEAH HOLMES, FACTORY REMIX, FERNLEY, NV"
,5,"DANICA APPENZELLER, DUKE CITY DEVELOPMENT, ALBUQUERQUE, NM"
,6,"CHASE BURIAN, ALPHA DEVELOPMENT, BOZEMAN, MT"
,7,"NOAH (NINJA) TENA, BOMBSHELL, BAKERSFIELD, CA"
,8,"LOGAN LEE, FACTORY ORCA BOMBSHELL, CALGARY, AB"
,,
9-10 Mixed Open    Total Riders = 57    Groups = 10,,
,1,"WYNTER GILL, S&M RACING, LAKE HAVASU CITY, AZ"
,2,"EMILEE WELLS, BICYCLE-X-CHANGE, WICHITA, KS"
,3,"DEACON LARSON, COLORADO SPRINGS, CO"
,4,"QUINN REILING, FACTORY ORCA BOMBSHELL, STRATHCONA COUNTY, AB"
,5,"CAMRYN (CRAZY LEGS) SEARFOSS, VELOCITY, NORWICH, NY"
,6,"ISABELLA LEIJA, JET RACING, FERNLEY, NV"
,7,"REAGAN RICE, CROSSROADS/RIVAL, PLAINFIELD, IN"
,8,"ASHTON PINNOY, FAITH RACE USA, SPRING, TX"
,,
11-12 Mixed Open    Total Riders = 52    Groups = 9,,
,1,"DANICA (LIL AVALANCHE)ANDERSON, LANCASTER, CA"
,2,"NICOLE FORONDA, BAY AREA BMXERS, MEDELLIN"
,3,"SOPHIA (SOPHAST) RODRIGUEZ, FACTORY YESS, BEND, OR"
,4,"BROOKLYN (SUPER B) VAN RENSELAAR, FACTORY GT, WEST JORDAN, UT"
,5,"LILY GREENOUGH, PURE BICYCLES, CAMBRIDGE"
,6,"RYDER HAJEK, ISRAEL RACING TEAM, LOS ANGELES, CA"
,7,"TAVIN (PRETZEL BOY) NOVELLY, SAINT PETERS, MO"
,8,"MAKYLLA PINO, TUFFGURLZ/FLY/BOX/J&R, LAS CRUCES, NM"
,,
13-14 Mixed Open    Total Riders = 58    Groups = 10,,
,1,"PATRICK CARVAJAL, BOGOTA"
,2,"JORDYN (THE RYTHYM) MIRANDA, BMX SHARKS, MOHAVE VALLEY, AZ"
,3,"KAMREN KRICKLER, SHEPHERDSTOWN, WV"
,4,"JACY MOORE, WIAWIS/LSG, PORT ORCHARD, WA"
,5,"BREANNA (MONSTER B) WINTER, FACTORY RIFT CANADA, ANTELOPE, CA"
,6,"COURTNEY (COURTS) OOSTENDORP, PURE OCEANIA, PACIFIC PINES, QLD"
,7,"STELLA (SLING SHOT) SUNSERI, JR BICYCLES.COM/SPEEDCO/AVIAN, SAN JOSE, CA"
,8,"AVA CORLEY, THRODWN, LA MIRADA, CA"
,,
15-16 Mixed Open    Total Riders = 33    Groups = 6,,
,1,"ESJA SHRIVER, BAY AREA BMXERS, LAKEWOOD, CA"
,2,"NENEKA NISHIMURA, TEAM GANTRIGGER, OSAKA"
,3,"SIERRA ALTENDORF, NONE, EVERETT, WA"
,4,"CAREY MCCREADY, YESS, BOULDER, CO"
,5,"TRINADEE STOFLET, MIDWEST PULL, GARLAND, TX"
,6,"NATHAN JONES, WEST COAST RACING, LAND O LAKES, FL"
,7,"JAKOBE IRVIN, JDUBS/STAY TRU4HIM, DUNCANVILLE, TX"
,8,"TEIGEN PASCUAL, FACTORY RIFT CANADA, GARIBALDI HIGHLANDS, BC"
,,
17-20 Mixed Open    Total Riders = 13    Groups = 2,,
,1,"KHRISTIAN KRICKLER, SHEPHERDSTOWN, WV"
,2,"MCKENZIE GAYHEART, FACTORY FULL TILT/RADIO, FORT WHITE, FL"
,3,"IAN BEILFUSS, WEST COAST RACING, LUTZ, FL"
,4,"MYA RAMOS, 505 RACING. 100%, ODI, ALBUQUERQUE, NM"
,5,"MADISON GOMES, BMX SHARKS, RIPON, CA"
,6,"KIANA BOTFIELD, BRENDALE, ACT"
,7,"BRYCE (THE ANIMAL) SPRAGUE, 2ND GEN, CARTHAGE, MO"
,8,"MEGAN DUDGEON, WISCONSIN RAPIDS, WI"
,,
21-25 Mixed Open    Total Riders = 6    Groups = 1,,
,1,"KAITLYN LARSON, BLACK WIDOW BMX, STACY, MN"
,2,"DAYTON ISAACS, BLACK WIDOW BMX, SAINT MICHAEL, MN"
,3,"NATHAN RILEY, SKIDMARK RACING, MIAMI, OK"
,4,"CARLY CURTIN, C-YAA, CHARLOTTE, NC"
,5,"CHEYENNE NOUD, FACTORY POWERS BIKE SHOP, RIDGE, NY"
,,
26-30 Mixed Open    Total Riders = 4    Groups = 1,,
,1,"TYLER SHUTTS, EXILE BLACK CROWN, KATY, TX"
,2,"BAYLIE KORTMAN, TUSTIN, CA"
,3,"JESSICA JAYNE, BLOTOUT GRAPHICS, EAST MORICHES, NY"
,,
31 & Over Mixed Open    Total Riders = 59    Groups = 10,,
,1,"ALEX ROSS, LANDSTAR RACING, ODESSA, TX"
,2,"JASON WAGNER, PROPHECY BMX USA, MISHAWAKA, IN"
,3,"RIGOBERTO (RIGO) SOLANO, ALPHA DEVELOPMENT, CITRUS HEIGHTS, CA"
,4,"JASON WARYAS, KBCO BMX, WATERFORD, MI"
,5,"MARCELO (MARCELO) OLIVEIRA, BOSTON, MA"
,6,"ALEX SNELL, CYCLE WORKS, LINCOLN, NE"
,7,"BRAD WORKING, OLYMPIA, WA"
,8,"TY (THE BAYOU BULLET) JOHNSON, JBR-JOHNSON'S BMX RACING, EUNICE, LA"
,,
6 & Under Open    Total Riders = 21    Groups = 4,,
,1,"JAXSON HOWELL, BMX SHARKS, HENDERSON, NV"
,2,"GREYSON (THE BULLET) SNEED, UNION RYDE CO, BAKERSFIELD, CA"
,3,"JACKSON (ALL ACTION) SCOGGINS, SSQUARED SOUTHEAST, MEMPHIS, TN"
,4,"CONNOR RODRIGUES, BOMBSHELL, LAKESIDE, CA"
,5,"JACKSON STAUFFER, BLACK WIDOW BMX, FARIBAULT, MN"
,6,"MILO MENCHACA, DYNAMITE NATION, NAPA, CA"
,7,"CANNON (CANNONBALL) SANCHEZ, LDC, HOLLISTER, CA"
,8,"ASHTON (BIG TEXAN) HESTER, PREMIER RACING, HEATH, TX"
,,
7-8 Open    Total Riders = 43    Groups = 8,,
,1,"JOSEPH MATHER, THRODWN, OMAHA, NE"
,2,"COHEN JAMES, FACTORY FULL TILT/RADIO, BAKERSFIELD, CA"
,3,"LEVI (CHAOS) WEIGEL, FACTORY REMIX, ROCKFORD, MI"
,4,"ESPEN WILKE, RACER CONCEPTS DEVO, OCONOMOWOC, WI"
,5,"PRESTON ESPELETA, THRODWN DEVELOPMENT, RIVERSIDE, CA"
,6,"PALMER WARD, FACTORY BOMBSHELL, LOUISVILLE, KY"
,7,"BLAKE FREEHLING, NORCAL/NEXT GENERATION, GRANITE BAY, CA"
,8,"AUSTIN (COMEBACK KID) GRIFFITH, INDEPENDENT ALL STAR, ATHENS, TX"
,,
9-10 Open    Total Riders = 46    Groups = 8,,
,1,"ROWDY HOLZER, WIAWIS/LSG, NEWCASTLE, CA"
,2,"JUSTIN (DR. J) PERKINS, SUPERCROSS BMX, GLENDALE, AZ"
,3,"BRYAN (SHATTY) SHATSWELL III, BMX SHARKS, BEAUMONT, CA"
,4,"AIDAN RAGLE, POWERLITE-DANSCOMP-DFR, APPLE VALLEY, CA"
,5,"MATTEO PIGO, FACTORY BLACKCROWN BMX, DALLAS, GA"
,6,"SAMUEL IVAS, J & R SPEEDCO, ADELAIDE, SA"
,7,"BRADY KING, MANGLER BMX, KENOSHA, WI"
,8,"JAYCE M. DUFFY, RIDECO, MONUMENT, CO"
,,
11-12 Open    Total Riders = 62    Groups = 11,,
,1,"SEAN (EL SUAVE) DAY, FACTORY FULL TILT/RADIO, TACOMA, WA"
,2,"COLE FREDERICK, FACTORY FULL TILT/RADIO, NEW ULM, MN"
,3,"CALLUM WOODBURY, UPPER COOMERA, QLD"
,4,"JOSHUA (LIL BUB) WHITE, SUPERCROSS BMX, KINGMAN, AZ"
,5,"SEBASTIAN ORDONEZ, DALLAS, TX"
,6,"TAMA ONEKAWA, FACTORY FULL TILT/RADIO, BILOELA, QLD"
,7,"EVAN MARKLEY, PUSHER BMX, FRANKTOWN, CO"
,8,"SHIN KONDO, DEUXROUES ELITE TEAM, OSAKA"
,,
13-14 Open    Total Riders = 69    Groups = 12,,
,1,"CEDRIC (THE ENTERTAINER) CADE, BMX SHARKS, LAS VEGAS, NV"
,2,"CUTTER WILLIAMS, WIAWIS/LSG, POTOMAC FALLS, VA"
,3,"ETHAN POPOVICH, MUDSLINGERS BIKE SHOP, VALPARAISO, IN"
,4,"JESS (JUMPIN JESS) BRANT, 6DHELMETS/SUPERCROSS/M&M, DELTONA, FL"
,5,"ELIJAH HEANEY, FACTORY POWERS BIKE SHOP, MURFREESBORO, TN"
,6,"TYLER BAILEY, ELITE BICYCLES/VENDETTA, SMITHFIELD, RI"
,7,"NATHAN KITCHEN, FACTORY FREE AGENT-BOX, BAKERSFIELD, CA"
,8,"GAGE BROWN, FACTORY YESS, BEND, OR"
,,
15-16 Open    Total Riders = 75    Groups = 13,,
,1,"BENNET GREENOUGH, PURE BICYCLES, CAMBRIDGE"
,2,"RICO BEARMAN, SPEEDCO/AVIAN, AUCKLAND"
,3,"EVAN SCHAEFER, ALLTOW WRECKING CREW/YESS, SARASOTA, FL"
,4,"JOSHUA VERON, JR BICYCLES.COM/SPEEDCO/AVIAN, CARMICHAEL, CA"
,5,"(THE DREAM TAKER)ZACH  JACOBS, DAYLIGHT CYCLES, MT JULIET, TN"
,6,"SANTIAGO SANTA, BAY AREA BMXERS, MEDELLIN"
,7,"MOKA BAN, IT"
,8,"NOLAN CARDWELL, RIVAL RACING, BELMONT, NC"
,,
17-20 Open    Total Riders = 44    Groups = 8,,
,1,"GONZALO RENGEL, JR BICYCLES.COM/SPEEDCO/AVIAN, QUEVEDO"
,2,"GAVIN FREEWALT, MANGLER/HARO, SCHAUMBURG, IL"
,3,"(ACTION) JACKSON ELLIOTT, NORCAL/NEXT GENERATION, GRANITE BAY, CA"
,4,"CAMERON BRAMER, WIAWIS/LSG, SOUTH PARK, PA"
,5,"TRISTON (LIMETIME) JUDD, PRIVATEER, HOWE, TX"
,6,"EVAN (BIG MAC) SINCHAK, FACTORY YESS, SEVERN, MD"
,7,"LOUIS KAMINSKI, TNT BICYCLES FACTORY, EDEN, NY"
,8,"DYLAN RAMOS, 505 RACING, ALBUQUERQUE, NM"
,,
21-25 Open    Total Riders = 23    Groups = 4,,
,1,"NICOLAS DETERS, THRODWN, ST PETERS, MO"
,2,"BRENDAN OBRIEN, FASTHOUSE, PHOENIX, AZ"
,3,"JASON KULLMAN, RRC-SUPERCROSS-FLY, HENDERSON, NV"
,4,"MICHAEL SCHNEIDER, BRICK, NJ"
,5,"JARED (DOC) JOHNSON, CARLISLE, OH"
,6,"CHAD HARPER, RIVAL RACING, INDIAN WELLS, CA"
,7,"DEACON KORTMAN, TUSTIN, CA"
,8,"ASHTON (QUICKDRAW) MCGRAW, COB AND 7!, NORTH LAS VEGAS, NV"
,,
26-30 Open    Total Riders = 16    Groups = 3,,
,1,"ROBERT FELTMAN, FACTORY GOLD'S GYM, PEARLAND, TX"
,2,"DEVIN GAEDTKE-SCHWARTZ, THRODWN DEVO, WISCONSIN RAPIDS, WI"
,3,"JAKE SVERNS, TANGENT RIFT ROCKSTAR, MELBOURNE, VIC"
,4,"ERIC HENDREN, TULSA, OK"
,5,"NICK ALEJANDRE, ARIZONA BICYCLE WERX/FALL RISK RACING, GLENDALE, AZ"
,6,"KYLE MATHIAS, BLACKWIDOW KANSAS, TOWANDA, KS"
,7,"MARC ESTEP, BELLFLOWER, CA"
,8,"MATT CALVIN, NORTH CHARLESTON, SC"
,,
31 & Over Open    Total Riders = 57    Groups = 10,,
,1,"JASON MORRIS, SE RACING, MORENO VALLEY, CA"
,2,"JUSTIN DODSON, FACTORY GOLD'S GYM, ROYSE CITY, TX"
,3,"ZACHARY BARRON, SAINT PETERS, MO"
,4,"JAKE BROWN, FACTORY ALPHA, STOCKTON, CA"
,5,"GEORGE (THE MANGLER) ANDREWS, MANGLER BMX, DAVIS JUNCTION, IL"
,6,"BILLY KORMAN, FORT COLLINS, CO"
,7,"CODY (COBRA) FREELS, RAISE FOR ROWYN, PUYALLUP, WA"
,8,"YO THACH, YESS BMX, ARLINGTON, TX"
,,
10 & Under Girls Cruiser    Total Riders = 28    Groups = 5,,
,1,"ANNALYSE SOLANO, ALPHA, CITRUS HEIGHTS, CA"
,2,"TAYLOR LEAKEY, ARIZONA BICYCLE WERX/FALL RISK RACING, PHOENIX, AZ"
,3,"KATE CLARRIDGE, RIDE LIKE A GIRL/DANS COMP, MARYSVILLE, OH"
,4,"MIA CUSTER, FACTORY BLACKCROWN BMX, BRIDGETON, NJ"
,5,"PRESLIE (PISTON) GOULD, IMPACT BMX RACING, HENDERSON, NV"
,6,"LILY (TIGERLILY) HINTON, POWERLITE-DANSCOMP-DFR, BROOKFIELD, IL"
,7,"LANDON BURIAN, ALPHA DEVELOPMENT, BOZEMAN, MT"
,8,"CARIS MCCONNELL, FACTORY SSQUARED, BRENTWOOD, TN"
,,
11-12 Girls Cruiser    Total Riders = 26    Groups = 5,,
,1,"DANICA (LIL AVALANCHE)ANDERSON, LANCASTER, CA"
,2,"ALEXIS ALDEN, JR BICYCLES.COM/SPEEDCO/AVIAN, PEACHTREE CITY, GA"
,3,"KYLEE NIEDERBERGER, FACTORY ANSWER, JARRETTSVILLE, MD"
,4,"CHRISTINA (BABY GIRL) CUNNINGHAM, LDC, HOLLISTER, CA"
,5,"SAMANTHA (SAMMY) WILLIAMSON, FACTORY BOMBSHELL/AVENT, GROVETOWN, GA"
,6,"HANNAH LEAKEY, ARIZONA BICYCLE WERX/FALL RISK RACING, PHOENIX, AZ"
,7,"SAVANNA STOKES, SPNCTY, LAS VEGAS, NV"
,8,"BREEANNE VAUGHAN, FACTORY BOMBSHELL/AVENT, WALNUT, CA"
,,
13-14 Girls Cruiser    Total Riders = 24    Groups = 4,,
,1,"CHLOE KAPPEN, FACTORY ANSWER, PHOENIXVILLE, PA"
,2,"ISABELLA (PACMAN) NELSON, MOM & DAD, SUFFIELD, CT"
,3,"KIRA BOUSTEAD, NVP/MACHINE TRAINING, VALLEJO, CA"
,4,"DESERAE (RAH RAH) ROMERO, FACTORY RIFT CANADA, VICTORVILLE, CA"
,5,"GRECIA CRISTODULO, FACTORY SSQUARED, DALLAS, TX"
,6,"SARAH PRUITT, SILVERDALE CYCLERY, BELFAIR, WA"
,7,"SOPHIA ROBBINS, VELOCITY BIKE CO, FREDERICKSBURG, VA"
,8,"LARKIN KORTMAN, TUSTIN, CA"
,,
15-16 Girls Cruiser    Total Riders = 20    Groups = 4,,
,1,"NENEKA NISHIMURA, TEAM GANTRIGGER, OSAKA"
,2,"CAITLYN (#MILKFIRST) FARMER, SANDY SPRINGS, GA"
,3,"MADELYNN DESANTIS, HARO, SIMI VALLEY, CA"
,4,"ALEXANDRA (BLONDE BOMB) HILL, ALPHA, SAUK RAPIDS, MN"
,5,"MELAINA (GRAPPLER) BEACHNER, DYSFUNCTIONAL BMX, HARRISONVILLE, MO"
,6,"JASMINE TOPPER, NO XCUSES/FLY/SSQUARED, VENTURA, CA"
,7,"SYDNEY SCHLOTTERBECK, 1-800 KAOS, HAGERSTOWN, MD"
,8,"KALI (WESTCOAST) STREETER, VENOM/BMA, BLAINE, MN"
,,
17-20 Women Cruiser    Total Riders = 20    Groups = 4,,
,1,"JAYCIE SINCLAIR, WIAWIS/LSG, SPRING, TX"
,2,"KORIE GILBERT, FACTORY BLACKCROWN BMX, PEARLAND, TX"
,3,"LEYNA JONES, RACEFAST, OXNARD, CA"
,4,"BRENNA BRADY, EXTREME TEAM, YUBA CITY, CA"
,5,"CARLY (THE HONEY BADGER) JACOBS, DAYLIGHT CYCLES, MOUNT JULIET, TN"
,6,"SAILOR MARTINI, LANDSTAR RACING, HOUSTON, TX"
,7,"STEVIE TOMPKINS, VENOM/BMA, MANKATO, MN"
,8,"DJ HARVEY, BLACK CROWN BIKE SHOP, ELKRIDGE, MD"
,,
21-30 Women Cruiser    Total Riders = 15    Groups = 3,,
,1,"ERIN JONES, LANDSTAR RACING, TULSA, OK"
,2,"MIKA KORTMAN, TUSTIN, CA"
,3,"LEXIE ALEJANDRE, ARIZONA BICYCLE WERX/FALL RISK RACING, GLENDALE, AZ"
,4,"EMILY MUNDAHL, STAATS, BISMARCK, ND"
,5,"BAYLIE KORTMAN, TUSTIN, CA"
,6,"KAITLYN WHITE, NORCAL/NEXT GENERATION, SACRAMENTO, CA"
,7,"EMILY FISK, COASTAL RACING, MEBANE, NC"
,8,"HEATHER (SILENT ASSASSIN) HAN, ON 2 WHEELS, MCCUNE, KS"
,,
31-35 Women Cruiser    Total Riders = 8    Groups = 1,,
,1,"ASHLEE HILL PETTINELLI, ALLTOW WRECKING CREW/YESS, SLINGERLANDS, NY"
,2,"KRYSTAL ROBINSON, RACE INC, PENDLETON, IN"
,3,"DANIELA CIFUENTES, CHIP-N-DALE, MOUNT HOLLY, NJ"
,4,"AMANDA (F BOMB) WARNER, 1-800 KAOS, SMITHSBURG, MD"
,5,"ALYSIA MITCHELL, RAD DUDES, PRATTVILLE, AL"
,6,"ANN MYERS, CARTHAGE, MO"
,7,"RACHEL LAMANCE, TEAM YOLO, TULSA, OK"
,,
36-40 Women Cruiser    Total Riders = 19    Groups = 3,,
,1,"JILL MCGUIRE, C-YAA, PARKER, CO"
,2,"JULIA BOTFIELD, BOMBSHELL, BRENDALE, QLD"
,3,"VIRGINIA (LEGS) LINGHAM, BAY AREA BMXERS, SAN DIEGO, CA"
,4,"CHRISTINA GAYLER, LANDSTAR RACING, DEL CITY, OK"
,5,"ALENA (WHITE SHOES) DZONLEZ, BANDIT RACING, REDWOOD CITY, CA"
,6,"LISA (LIGHTING LEGGS) WEBB, 1-800 KAOS, QUEENSTOWN, MD"
,7,"MARY RICE, LINCOLN, NE"
,8,"BROOKE CAVNER, ALBES, ROCKFORD, MI"
,,
41-45 Women Cruiser    Total Riders = 16    Groups = 3,,
,1,"HIDI CRAMER, GUNSLINGER FACTORY/ONEAL/ERA3, DES MOINES, WA"
,2,"REBEKAH THREATT, ALPHA, SAN MARTIN, CA"
,3,"NEVEN STEINMETZ, ARIZONA BICYCLE WERX/FALL RISK RACING, LAFAYETTE, CO"
,4,"SHEILA (SHE-RA) KAUPPI, PRODIGY RACING, EAST BETHEL, MN"
,5,"CASEY ALLEN, PREMIER RACING, HEARTLAND, TX"
,6,"MELISSA BRAY, BMX SHARKS, LAS VEGAS, NV"
,7,"ANGELA CONSTANTINO, COASTAL RACING, WHITSETT, NC"
,8,"AMY GRAWEY, SRT, SAINT PETERS, MO"
,,
46-50 Women Cruiser    Total Riders = 14    Groups = 2,,
,1,"CHRISSY PIPER, JAWBREAKER, LOS ANGELES, CA"
,2,"SUSIE LEVAN, TNT BICYCLES FACTORY, NORTH PLAINFIELD, NJ"
,3,"MICHELLE SENGER, FACTORY ANSWER, CARMEL, IN"
,4,"SHANNON ""SINGING"" SILVA, NASHVILLE, TN"
,5,"LIZA ARNOLD, CROSSROADS, WARSAW, IN"
,6,"MIA RITTENHOUSE, DAYTON, OH"
,7,"DAWN (DUSTY DAWN) JABOUR, MILLER THOMSON BUILDER'S, AUSTIN, TX"
,8,"BECKY MOHR, MOHR COFFEE, LAKE HAVASU CITY, AZ"
,,
51-55 Women Cruiser    Total Riders = 8    Groups = 1,,
,1,"MARJORIE (MAMA MARGE) KAMINSKI, STYLIN, EDEN, NY"
,2,"MARCY DAVIS, NVP/TROYLEE/TANGENT, RENO, NV"
,3,"SUZANNE BLACK, GATE 8 BMX CLOTHING, PHOENIX, AZ"
,4,"BARB (THE BANDIT) BASAJ, SSQUARED WISCONSIN, MILWAUKEE, WI"
,5,"ELIZABETH JONES, SAINT PETERSBURG, FL"
,6,"LAURA (KNOCKKNOCK) BOHNE, GOSHEN, KY"
,7,"SUNNY (THING 1) HARMESON, GUNSLINGER FACTORY/ONEAL/ERA3, PENDLETON, OR"
,,
56 & Over Women Cruiser    Total Riders = 5    Groups = 1,,
,1,"SUZANNE BORLAND, GILBERT, AZ"
,2,"CARRIE MUNDAHL, ELITE CAMP, BISMARCK, ND"
,3,"SHELLY ZIMMERMAN, POWERS BIKE SHOP, MANASSAS, VA"
,4,"KITTIE WESTON-KNAUER, STANGE MOTION/KICKER, DES MOINES, IA"
,,
7 & Under Cruiser    Total Riders = 34    Groups = 6,,
,1,"KNOX (THE OX) PERKINS, MIDVALE, UT"
,2,"WYATT (WY-FI) CHRISTENSEN, FACTORY ORCA BOMBSHELL, KINGSTON, WA"
,3,"MARSHALL (THE KID) WARNER, FACTORY FREE AGENT-BOX, SMITHSBURG, MD"
,4,"CLYDE (THE SLIDE) SANTOS, FAITH RACE USA, LANCASTER, PA"
,5,"PAXTON (LITTLE BEAST) COON, H H CONSTRUCTION, GRAND JUNCTION, CO"
,6,"DAMON FISHER, HENDERSON, NV"
,7,"JACOB THEISEN, SAINT CLOUD, MN"
,8,"COLTON (THUNDER) JOHNSON, WIAWIS DEVELOPMENT, WEST MONROE, LA"
,,
8 Cruiser    Total Riders = 37    Groups = 7,,
,1,"JOSEPH MATHER, THRODWN, OMAHA, NE"
,2,"LIAN AUYON, JR BICYCLES.COM/SPEEDCO/AVIAN, HEBER, CA"
,3,"COGAN MARTIN-KERSEY, FACTORY POWERS BIKE SHOP, WOODBRIDGE, VA"
,4,"HENRY (FREAKIN) LENERS, VENOM/BMA, SAINT FRANCIS, MN"
,5,"LEVI (CHAOS) WEIGEL, FACTORY REMIX, ROCKFORD, MI"
,6,"KILIAN (KILLIN IT) SANTOS, FAITH RACE USA, LANCASTER, PA"
,7,"CONNOR WEST, ALPHA, CHANDLER, AZ"
,8,"DEVIN WALZ, FLY RACING / SUPERCROSS, MERIDIAN, ID"
,,
9 Cruiser    Total Riders = 31    Groups = 6,,
,1,"HAYDEN PASSANISI, JR BICYCLES.COM/SPEEDCO/AVIAN, ALPINE, CA"
,2,"KAIDEN (BOOMERANG) IRELAND, THE BIKE MASTER, EVERSON, WA"
,3,"JORGE (DEVIL DOG) MONTANO III, BMX SHARKS, ROSAMOND, CA"
,4,"COLTON KIDD, EXTREME TEAM, VAIL, AZ"
,5,"DYLAN (AZ) PATTERSON, DAYLIGHT CYCLES, TUCSON, AZ"
,6,"ACE LAACK, BLACK WIDOW BMX, ROCHESTER, MN"
,7,"GUNNAR (GUNGEY) SHIPPY, KILL EM ALL, INDEPENDENCE, MO"
,8,"ARJUNA BURGOS, FACTORY YESS, LOS ANGELES, CA"
,,
10 Cruiser    Total Riders = 46    Groups = 8,,
,1,"ROWDY HOLZER, WIAWIS/LSG, NEWCASTLE, CA"
,2,"DANIEL WATERS, FACTORY ANSWER, VICTORVILLE, CA"
,3,"WILLIAM (THE SLEEPER) EDMONDS, MUM AND DAD, GLEN HEAD, NY"
,4,"CONNOR CLIFFORD, DAYLIGHT CYCLES, HURRICANE, UT"
,5,"CADEN (KILLER MILER) MILLER, FIDELIO DOG WORKS, AUSTIN, TX"
,6,"JACK (JACK JACK) KNOROWSKI, WIAWIS/LSG, PHOENIX, AZ"
,7,"BRYAN (SHATTY) SHATSWELL III, BMX SHARKS, BEAUMONT, CA"
,8,"CUTTER GODAIRE, BMX SHARKS, MESA, AZ"
,,
11 Cruiser    Total Riders = 31    Groups = 6,,
,1,"KARTER MONTELLANO, FACTORY ANSWER, RIVERSIDE, CA"
,2,"RYDER (RIPPIN RYDER) ROBINETT, GLENDALE, AZ"
,3,"MAX CLARK, ELITE BICYCLES/VENDETTA, CARMICHAEL, CA"
,4,"COHEN BUNDY, WIAWIS/LSG, FT COLLINS, CO"
,5,"RYAN RANDOLPH, PURE/AVIAN USA, TUCSON, AZ"
,6,"ELI ESTENSEN, CHICO, CA"
,7,"TOMMY BRUNEY, FACTORY FULL TILT/RADIO, PITTSBURGH, PA"
,8,"MASON HAYES, C-YAA, DENVER, NC"
,,
12 Cruiser    Total Riders = 44    Groups = 8,,
,1,"JUAN JOSE MANOSCA, BAY AREA BMXERS, A"
,2,"AVERY FULTON, FACTORY FREE AGENT-BOX, CAMBRIDGE, MN"
,3,"CHAYSE MRAZEK, PRIMAL BMX, BISHOP, TX"
,4,"BRADY ONEIL, DAYLIGHT CYCLES, HENDERSON, NV"
,5,"TARIN (TARIN IT UP) FIELDS, ALPHA, NEWMAN LAKE, WA"
,6,"RILEY ALLEN, RIFT/TANGENT, FORT MILL, SC"
,7,"HARLEY (GNARLY) DAIS, BLACK WIDOW BMX, WINONA, MN"
,8,"CASSHE (CASH MONEY) HOPSON, SPEEDLINE, NORTH LAS VEGAS, NV"
,,
13 Cruiser    Total Riders = 51    Groups = 9,,
,1,"RONNIE (THE ASSASSIN) KIM, FACTORY BOX COMPONENTS, CORONA, CA"
,2,"LUCAS ZIMMERMANN, FACTORY FULL TILT/RADIO, BRAZIL, SC"
,3,"ANDREW TREJO, SE RACING, LANCASTER, CA"
,4,"TREYSON DILLON, ELIZABETH, MN"
,5,"PARKER RESPASS, WIAWIS/LSG, CHESAPEAKE, VA"
,6,"DOUGLAS SCHMEICHEL, DRIVEN CYCLING ACADEMY, KUNA, ID"
,7,"BROCK (THE ROCKET) SMITH, BLACK WIDOW BMX, WEST FARGO, ND"
,8,"TYLER WINSOR, CHASE, BELLEVUE, NE"
,,
14 Cruiser    Total Riders = 31    Groups = 6,,
,1,"THOMAS TUCKER, FACTORY FULL TILT/RADIO, WARNER, QLD"
,2,"JAYCE BARTLEY, LDC, MILWAUKIE, OR"
,3,"MICHAEL BENNETT, NVP/MACHINE TRAINING, NAPA, CA"
,4,"DRAKE VELADOR, PROFILE RACING, HOLLISTER, CA"
,5,"JOSHUA STERLING, FACTORY SSQUARED, VALPARAISO, IN"
,6,"CANNON (THE HAMMER) WOOD, THRODWN, YUKON, OK"
,7,"ZACK DRINKARD, VELOCITY BIKE CO, MECHANICSVILLE, VA"
,8,"JOHN HAYNES IV, COEUR D ALENE, ID"
,,
15 Cruiser    Total Riders = 28    Groups = 5,,
,1,"JULIAN (CYBORG) BASAJ, FACTORY SSQUARED, MILWAUKEE, WI"
,2,"MIKKEL DEVORE, VERADALE, WA"
,3,"CEASAR FLORES, LDC, ATWATER, CA"
,4,"BEAUDIE (THE BOSS) TRADUP, GORDY'S BICYCLES, PHOENIX, AZ"
,5,"JACOB TRUJILLO, FACTORY ANSWER, RANCHO PALOS VERDES, CA"
,6,"BLAKE POWELL, VELOCITY BIKE CO, VIRGINIA BEACH, VA"
,7,"RYAN BRAMER, FACTORY BLACKCROWN BMX, SOUTH PARK, PA"
,8,"JORDAN CALLUM, RIVAL RACING, BALDIVIS, WA"
,,
16 Cruiser    Total Riders = 24    Groups = 4,,
,1,"WESTON MEURLOT, FACTORY GT, NEW SMYRNA BEACH, FL"
,2,"AMAKYE ANDERSEN, DAYLIGHT CYCLES, TUCSON, AZ"
,3,"PRESTON EVANS, SIXES PIT BIKE SHOP, MARIETTA, GA"
,4,"ZAINE (BIG DADDY) STENSON, RAISEFORROWYN.ORG, MAPLE VALLEY, WA"
,5,"TYLER (THUNDERFOOT) HAGAN, TWISTED CONCEPTS, GRAIN VALLEY, MO"
,6,"COLE ZUFELT, C-YAA, TRENTON, ON"
,7,"RYDER (GHOST RYDER) WARD, KEGALS, MACHESNEY PARK, IL"
,8,"DEVIN (DIAMOND DEVIN) NELSON, BLACK WIDOW BMX, ISANTI, MN"
,,
17-20 Cruiser    Total Riders = 43    Groups = 8,,
,1,"EVAN (BIG MAC) SINCHAK, FACTORY YESS, SEVERN, MD"
,2,"NICKOLAS (NICK THE BRICK) ELLIOTT, NORCAL/NEXT GENERATION, GRANITE BAY, CA"
,3,"KYLE JENSEN, PURE/AVIAN USA, TUCSON, AZ"
,4,"NICOLAS TREJO, SE RACING, LANCASTER, CA"
,5,"NOAH TANKER, FACTORY FULL TILT/RADIO, MACHESNEY PARK, IL"
,6,"NATHAN DAVIDS, FACTORY SSQUARED, KAUKAUNA, WI"
,7,"BRANDON LOUDERMILK, GUNSLINGER FACTORY/ONEAL/ERA3, SALEM, OR"
,8,"(ACTION) JACKSON ELLIOTT, NORCAL/NEXT GENERATION, GRANITE BAY, CA"
,,
21-25 Cruiser    Total Riders = 19    Groups = 3,,
,1,"SHANE (DA MONSTER) HARLOW, ELITE BICYCLES/VENDETTA, MORENO VALLEY, CA"
,2,"DUSTIN HAMMOND, FACTORY ANSWER, COLUMBIA, KY"
,3,"MICHAEL (BANZAI) BONESSI, HYPER BODY ARMOR, HENDERSONVILLE, NC"
,4,"GARRETT (THE GUNSHOT) NORTHINGTON, 3B RACING, HAYDEN, ID"
,5,"BRIAN (MONEYBAGS) THIERWECHTER, C-YAA, SANDWICH, MA"
,6,"JUSTIN GAEDTKE-SCHWARTZ, FACTORY SSQUARED, WISCONSIN RAPIDS, WI"
,7,"CARTER ONEAL, ARIZONA BICYCLE WERX/FALL RISK RACING, PHOENIX, AZ"
,8,"BRAD LEWIS, YESS, CLEVELAND, TN"
,,
26-30 Cruiser    Total Riders = 23    Groups = 4,,
,1,"SHAUN (PIVOT MAN) CHANDLER, WIFE AND SONS, TUCSON, AZ"
,2,"STACEY EDEN, RIVAL RACING, SIMPSONVILLE, KY"
,3,"BRENNAN BUISO, DURANGO, CO"
,4,"TYSON JURGENS, MAJESTY RACING, LINCOLN, NE"
,5,"JAKE SHEPHERD, BMX ELITE, BUCKLEY, WA"
,6,"DUSTIN JACOBS, REAL TIME BMX, FREEPORT, IL"
,7,"CURTIS SHOOK, DUOXX BIKES, ROBESOINA, PA"
,8,"CODY (THE REALTOR CODY) HARRIS, BMXTC, NAMPA, ID"
,,
31-35 Cruiser    Total Riders = 22    Groups = 4,,
,1,"JASON MORRIS, SE RACING, MORENO VALLEY, CA"
,2,"CHRIS SUTTON, FACTORY ANSWER, GLENDALE, AZ"
,3,"KYLE ROBINSON, RACE INC, PENDLETON, IN"
,4,"MATT ALEXANDER, ARIZONA BICYCLE WERX/FALL RISK RACING, PEORIA, AZ"
,5,"NICHOLAS VALENCIA, SUPERCROSS BMX, NEWARK, CA"
,6,"NICHOLAS HURST, REAL TIME BMX, RIVERTON, IL"
,7,"MARK SHAW, RAISE FOR ROWYN, CHANDLER, AZ"
,8,"SHAWN WADE, ALPHA, MACHESNEY PARK, IL"
,,
36-40 Cruiser    Total Riders = 25    Groups = 5,,
,1,"ERIC BACA, ALPHA, PHOENIX, AZ"
,2,"ADAM SCOTT, THRODWN, OKLAHOMA CITY, OK"
,3,"ANDY ANDREE, LOGIC BMX/ MOTO ONE, NAMPA, ID"
,4,"DONALD (FIREBALL) JUNTUNEN, RAISE FOR ROWYN, PUYALLUP, WA"
,5,"RYAN WEBER, CORONA, CA"
,6,"ALEX ROSS, LANDSTAR RACING, ODESSA, TX"
,7,"MICHEL PERKINS, BOIS-DES-FILION, QC"
,8,"JESSE HAUGEN, VENOM/BMA, EAST BETHEL, MN"
,,
41-45 Cruiser    Total Riders = 32    Groups = 6,,
,1,"CHAD STREET, FACTORY GOLD'S GYM, RICHLAND HILLS, TX"
,2,"ROBERT TAYLOR, LANDSTAR RACING, BAYTOWN, TX"
,3,"BRENT LEE, BAY AREA BMXERS, UNIVERSITY PLACE, WA"
,4,"PAULO MOREIRA, DL TRAINING ,POWERCYCLE, ORLANDO, FL"
,5,"JASON YOUNG, YESS BMX, WINFIELD, MO"
,6,"MATT DALLAS, BLOT OUT GRAPHICS, COS COB, CT"
,7,"FABIAN (COLOMBIA) GONZALEZ, COLOMBIA, GAITHERSBURG, MD"
,8,"CORY SKINNER, C-YAA, HUDSON, OH"
,,
46-50 Cruiser    Total Riders = 46    Groups = 8,,
,1,"SHAWN DIPRETE, C-YAA, DUXBURY, MA"
,2,"JASON CARNES, BERM ACADEMY-SSQUARED, AUSTIN, TX"
,3,"JEREMY THOMPSON, FACTORY ANSWER, GRAHAM, NC"
,4,"MITCH BINGHAM, CHATTANOOGA, TN"
,5,"DAVID ARCHIBALD, PRIVATEER, PUYALLUP, WA"
,6,"AL ROYBAL, FACTORY ANSWER, PRUNEDALE, CA"
,7,"JIM NELSON, ELITE BICYCLES/VENDETTA, SACRAMENTO, CA"
,8,"JEAN MARC DURVIAUX, FACTORY YESS, LOS ANGELES, CA"
,,
51-55 Cruiser    Total Riders = 41    Groups = 7,,
,1,"STEVE CLARK, RAISE FOR ROWYN, BUCKLEY, WA"
,2,"GEORGE GOODALL, SUPERCROSS BMX, CHANDLER, AZ"
,3,"KENT ELLIOTT, NORCAL/NEXT GENERATION, GRANITE BAY, CA"
,4,"VINCENT DECASTRO, NOPE, ALPHARETTA, GA"
,5,"TOM JOHNSON, FACTORY YESS, PALM COAST, FL"
,6,"SCOTT BOECKER, PRODIGY RACING, HAM LAKE, MN"
,7,"ALFONSO (PAPA G) GIGANTI, SRT-REDLINE  ODI OGIO, CHESTERFIELD, MO"
