,1,"JASE ALLEN, #JUSTJASERACING, ROCK HILL, SC"
,2,"JOSEPH MATHER, THRODWN, OMAHA, NE"
,3,"COHEN JAMES, FACTORY FULL TILT/RADIO, BAKERSFIELD, CA"
,4,"BRAYDEN GORIS, DL BMX, ORMOND BEACH, FL"
,5,"LIAN AUYON, JR BICYCLES.COM/SPEEDCO/AVIAN, HEBER, CA"
,6,"KEEGAN SKINNER, FACTORY SSQUARED, SURPRISE, AZ"
,7,"JAKE MORGAN, BOMBSHELL/100%/ODI, MURRIETA, CA"
,8,"CONNOR WEST, ALPHA, CHANDLER, AZ"
,,
9 Expert    Total Riders = 63    Groups = 11,,
,1,"HAYDEN PASSANISI, JR BICYCLES.COM/SPEEDCO/AVIAN, ALPINE, CA"
,2,"ELI (LY-LY) STATON, FACTORY FULL TILT/RADIO, BELTON, MO"
,3,"BRADY KING, MANGLER BMX, KENOSHA, WI"
,4,"GUSTAVS DAUGAVIETIS, PRECISION BMX, LAKE FOREST, CA"
,5,"COLTON KIDD, EXTREME TEAM, VAIL, AZ"
,6,"LUKAS SMITH, FCR- SPEEDCO/ SEVEN, FORT COLLINS, CO"
,7,"JORGE (DEVIL DOG) MONTANO III, BMX SHARKS, ROSAMOND, CA"
,8,"WYATT HICKS, FACTORY BLACKCROWN BMX, KENNESAW, GA"
,,
10 Expert    Total Riders = 78    Groups = 13,,
,1,"JUSTIN (DR. J) PERKINS, SUPERCROSS BMX, GLENDALE, AZ"
,2,"AIDAN RAGLE, POWERLITE-DANSCOMP-DFR, APPLE VALLEY, CA"
,3,"ROWDY HOLZER, WIAWIS/LSG, NEWCASTLE, CA"
,4,"DANIEL WATERS, FACTORY ANSWER, VICTORVILLE, CA"
,5,"DALLEN BRERETON-STILES, FACTORY RIFT CANADA, COQUITLAM, BC"
,6,"JACK CERNEY, FACTORY YESS, COQUITLAM, BC"
,7,"MATTEO PIGO, FACTORY BLACKCROWN BMX, DALLAS, GA"
,8,"JAYCE M. DUFFY, RIDECO, MONUMENT, CO"
,,
11 Expert    Total Riders = 77    Groups = 13,,
,1,"GAIGE GOMOLICKE, BAY AREA BMXERS, UKIAH, CA"
,2,"KARTER MONTELLANO, FACTORY ANSWER, RIVERSIDE, CA"
,3,"MAX CLARK, ELITE BICYCLES/VENDETTA, CARMICHAEL, CA"
,4,"SEBASTIAN ORDONEZ, DALLAS, TX"
,5,"LUCAS ZHOU, MONSTER BIKE SUPPLY/SUPERCROSS, SURREY, BC"
,6,"BRAXTON MILLER, WIAWIS/LSG, BLUE SPRINGS, MO"
,7,"MASON HAYES, C-YAA, DENVER, NC"
,8,"COHEN BUNDY, WIAWIS/LSG, FT COLLINS, CO"
,,
12 Expert    Total Riders = 81    Groups = 14,,
,1,"SEAN (EL SUAVE) DAY, FACTORY FULL TILT/RADIO, TACOMA, WA"
,2,"COLE FREDERICK, FACTORY FULL TILT/RADIO, NEW ULM, MN"
,3,"CALLUM WOODBURY, UPPER COOMERA, QLD"
,4,"JOSHUA (LIL BUB) WHITE, SUPERCROSS BMX, KINGMAN, AZ"
,5,"RYDER LAWRENCE, ALBES, MENIFEE, CA"
,6,"BRAYDEN (GQ) DELANY, POWERLITE-DANSCOMP-DFR, COLORADO SPRINGS, CO"
,7,"HARLEY (GNARLY) DAIS, BLACK WIDOW BMX, WINONA, MN"
,8,"JUAN JOSE MANOSCA, BAY AREA BMXERS, A"
,,
13 Expert    Total Riders = 89    Groups = 15,,
,1,"RONNIE (THE ASSASSIN) KIM, FACTORY BOX COMPONENTS, CORONA, CA"
,2,"CEDRIC (THE ENTERTAINER) CADE, BMX SHARKS, LAS VEGAS, NV"
,3,"TRUE (TRUDAT) BAILEY, WIAWIS/LSG, LAKE TAPPS, WA"
,4,"MARSHALL (MAJOR) GEHRKE, FACTORY ANSWER, ANTIOCH, IL"
,5,"CHARLES ST ROMAIN, CLAYBORN/ANSWER FACTORY, BATON ROUGE, LA"
,6,"PARKER RESPASS, WIAWIS/LSG, CHESAPEAKE, VA"
,7,"ANDREW TREJO, SE RACING, LANCASTER, CA"
,8,"LUCAS ZIMMERMANN, FACTORY FULL TILT/RADIO, BRAZIL, SC"
,,
14 Expert    Total Riders = 82    Groups = 14,,
,1,"THOMAS TUCKER, FACTORY FULL TILT/RADIO, WARNER, QLD"
,2,"CUTTER WILLIAMS, WIAWIS/LSG, POTOMAC FALLS, VA"
,3,"JOSHUA TRERISE, FACTORY FULL TILT/RADIO, SHERWOOD, OR"
,4,"JAYCE BARTLEY, LDC, MILWAUKIE, OR"
,5,"GUYLHERME QUEIROZ CARNEIRO, MURIAE, MG"
,6,"JOSHUA STERLING, FACTORY SSQUARED, VALPARAISO, IN"
,7,"ROCCO PESATURO, JR BICYCLES.COM/SPEEDCO/AVIAN, ROYAL PALM BEACH, FL"
,8,"TYLER BAILEY, ELITE BICYCLES/VENDETTA, SMITHFIELD, RI"
,,
15 Expert    Total Riders = 75    Groups = 13,,
,1,"BRANDON (BIRDMAN) CRAIN, FACTORY ANSWER, RIVERSIDE, CA"
,2,"NOLAN CARDWELL, RIVAL RACING, BELMONT, NC"
,3,"JORDAN CALLUM, RIVAL RACING, BALDIVIS, WA"
,4,"CHRISTOPHER HOBBIE, FACTORY BLACKCROWN BMX, MANAHAWKIN, NJ"
,5,"KYLE HEWIG, DAYLIGHT CYCLES, NEWBURY PARK, CA"
,6,"SANTIAGO SANTA, BAY AREA BMXERS, MEDELLIN"
,7,"BRODY COLE, FACTORY FULL TILT/RADIO, SPRING, TX"
,8,"SANTIAGO URRIBARRI, COLOMBIA, BOGOTA"
,,
16 Expert    Total Riders = 66    Groups = 11,,
,1,"BENNET GREENOUGH, PURE BICYCLES, CAMBRIDGE"
,2,"DREW POLK, WIAWIS/LSG, AVON, IN"
,3,"RICO BEARMAN, SPEEDCO/AVIAN, AUCKLAND"
,4,"ALEXIS PIECZANOWSKY, SAUTERRE"
,5,"DYLAN WOOD, FACTORY FULL TILT/RADIO, HOUSTON, TX"
,6,"WESTON MEURLOT, FACTORY GT, NEW SMYRNA BEACH, FL"
,7,"JOSHUA VERON, JR BICYCLES.COM/SPEEDCO/AVIAN, CARMICHAEL, CA"
,8,"RYAN ALDER, WWW.2020TEKNOLOGY.COM, ELDERSBURG, MD"
,,
17-20 Expert    Total Riders = 104    Groups = 18,,
,1,"RILEY (HOOOOUUUUSE!!!!) HOUSE, SUPERCROSS BMX, GILBERT, AZ"
,2,"KYE AFFOO, FACTORY FULL TILT/RADIO, WARNER, QLD"
,3,"BRAYDEN (THE BULLET) KEMPEL, ALPHA, RAMSEY, MN"
,4,"LOUIS KAMINSKI, TNT BICYCLES FACTORY, EDEN, NY"
,5,"SPENCER COLE, DK BICYCLES, PALM HARBOR, FL"
,6,"NICHOLAS (QUICK NICK) ADAMS, ROCKSTAR RIFT TANGENT, ORANGEVALE, CA"
,7,"CAMERON WOOD, ALPHA, PEORIA, AZ"
,8,"RACE LEE, FACTORY FULL TILT/RADIO, DERBY, KS"
,,
21-25 Expert    Total Riders = 52    Groups = 9,,
,1,"DUSTIN HAMMOND, FACTORY ANSWER, COLUMBIA, KY"
,2,"NICOLAS DETERS, THRODWN, ST PETERS, MO"
,3,"KIT BJERK, VELOCIOUS SPORT, ARCHDALE, NC"
,4,"ASHTON (QUICKDRAW) MCGRAW, COB AND 7!, NORTH LAS VEGAS, NV"
,5,"DEACON KORTMAN, TUSTIN, CA"
,6,"SHANE (DA MONSTER) HARLOW, ELITE BICYCLES/VENDETTA, MORENO VALLEY, CA"
,7,"TYLER DUDEK, 327 DESIGNS, MURRIETA, CA"
,8,"LOGAN PAIGE, BLACK WIDOW BMX, ELK RIVER, MN"
,,
26-35 Expert    Total Riders = 48    Groups = 8,,
,1,"MATT WILCOX, THRODWN, DENVER, CO"
,2,"JASON MORRIS, SE RACING, MORENO VALLEY, CA"
,3,"CHRIS SUTTON, FACTORY ANSWER, GLENDALE, AZ"
,4,"ROBERT FELTMAN, FACTORY GOLD'S GYM, PEARLAND, TX"
,5,"CODY (THE REALTOR CODY) HARRIS, BMXTC, NAMPA, ID"
,6,"BRADY LAVOI, FULL TILT/RADIO, ST. CLOUD, MN"
,7,"LARRY HUFF, THE BOWLING TEAM, THORNTON, CO"
,8,"BRENNAN BUISO, DURANGO, CO"
,,
36-40 Expert    Total Riders = 40    Groups = 7,,
,1,"JAKE BROWN, FACTORY ALPHA, STOCKTON, CA"
,2,"RYAN BUONO, 316 RACING, SAN DIEGO, CA"
,3,"ERIC BACA, ALPHA, PHOENIX, AZ"
,4,"LONDON JOHNSON, BAY AREA BMXERS, CAMPBELL, CA"
,5,"ADAM (NINJA) WELTER, VENOM/BMA, EAGAN, MN"
,6,"GREG CUSTER, FACTORY BLACKCROWN BMX, BRIDGETON, NJ"
,7,"ADAM SCOTT, THRODWN, OKLAHOMA CITY, OK"
,8,"BENEDITO JUNIOR, SAMBAWA, SE"
,,
41-45 Expert    Total Riders = 34    Groups = 6,,
,1,"CHAD STREET, FACTORY GOLD'S GYM, RICHLAND HILLS, TX"
,2,"ROBERT TAYLOR, LANDSTAR RACING, BAYTOWN, TX"
,3,"JASON SILVA, GORDY'S BICYCLES, GLENDALE, AZ"
,4,"BRENT LEE, BAY AREA BMXERS, UNIVERSITY PLACE, WA"
,5,"YO THACH, YESS BMX, ARLINGTON, TX"
,6,"JEFF AANA, ALPHA, WALNUT CREEK, CA"
,7,"WAYNE ROON, FLY ZONE RACING, VALPARAISO, IN"
,8,"MARK JACKSON, BAY AREA BMXERS, FREMONT, CA"
,,
46-50 Expert    Total Riders = 31    Groups = 6,,
,1,"RENATO SILVA, ALLTOW WRECKING CREW/YESS, WINTER GARDEN, FL"
,2,"SHAWN DIPRETE, C-YAA, DUXBURY, MA"
,3,"DREW DOWNEY, DAYLIGHT CYCLES, MONUMENT, CO"
,4,"JEREMY THOMPSON, FACTORY ANSWER, GRAHAM, NC"
,5,"MITCH BINGHAM, CHATTANOOGA, TN"
,6,"JIM NELSON, ELITE BICYCLES/VENDETTA, SACRAMENTO, CA"
,7,"KEN HEXIMER, ARIZONA BICYCLE WERX/FALL RISK RACING, GLENDALE, AZ"
,8,"JEAN MARC DURVIAUX, FACTORY YESS, LOS ANGELES, CA"
,,
51 & Over Expert    Total Riders = 34    Groups = 6,,
,1,"BILLY GRIGGS, RAZOR/CHASE/ ELVEN, ANAHEIM, CA"
,2,"BUBBA (BLAZE) HAYES, RIDCO, COLORADO SPRINGS, CO"
,3,"CODY SMART, ALLSPEED MOTORSPORTSEXPO, FRIENDSWOOD, TX"
,4,"ERIC RUPE, REDLINE/OAKLEY/UGLY KID CLOTHING, WOODLAND HILLS, CA"
,5,"ANDY CURRIE, CHIP-N-DALE, MT HOLLY, NJ"
,6,"STEVE EWART, CRISP BROS RACING, BRAY PARK, QLD"
,7,"ALFONSO (PAPA G) GIGANTI, SRT-REDLINE  ODI OGIO, CHESTERFIELD, MO"
,8,"SHAWN (SWIFTY) OGORMAN, SUPERCROSS BMX, MARYSVILLE, CA"
