Stars and Stripes National #1,,
5 & Over Balance Bike    Total Riders = 3    Groups = 1,,
,1,"ADDYSON BATTAGLIA, EXPORT, PA"
,1,"COLTON (WRECKING BALL) KEEN, YESS, AMANDA, OH"
,1,"NATHAN MEREDITH, PITTSBURGH, PA"
,,
4 Balance Bike    Total Riders = 9    Groups = 2,,
,1,"RAELYN (CHUCKY) JASON, DOVER, DE"
,1,"JULEO DIBERNARDO, MONONGAHELA, PA"
,1,"SOPHIE KOPETSKIE, BURLINGTON, NC"
,1,"KODI KNOWLES, EVANSTON, IL"
,1,"CLAIRE PASCUZZI, SLICKVILLE, PA"
,1,"BRECKEN MILLER, PITTSBURGH, PA"
,1,"JULIANA DENEA, ORCHARD PARK, NY"
,1,"BRADY HUDZIK, BETHEL PARK, PA"
,,
3 Balance Bike    Total Riders = 3    Groups = 1,,
,1,"KAELYN MILLER, APALACHIN, NY"
,1,"BRYNLEE HARMON, LEBANON, OH"
,1,"BRAYLYNN BIJARRO, MONROE, MI"
,,
1-2 Balance Bike    Total Riders = 2    Groups = 1,,
,1,"TEMPERANCE MELTON, SOUTH JORDAN, UT"
,1,"GAVIN BUNKER, VALRICO, FL"
,,
A Pro    Total Riders = 15    Groups = 6,,
,1,"JAYCE CUNNING, SPEEDCO/AVIAN, BARINGA, QLD"
,2,"NICK (NICKY D) DAWSON, NO XCUSES/SSQUARED/BOX, PITTSBURGH, PA"
,3,"BRANDON ROHARIK, STANDARD BYKE CO, AKRON, OH"
,4,"THOMAS ZULA, DK BICYCLES, DAYTON, OH"
,5,"TYLER PETTY, SEVEN MX, CYPRESS, TX"
,6,"JUSTIN KNAPPER, FACTORY ANSWER, POTTSTOWN, PA"
,7,"LUKE ROARTY, HYPER BICYCLES, CLARKSVILLE, MD"
,8,"JUSTIN RICHMOND, RIVAL RACING, COUNTRYSIDE, IL"
,,
Vet Pro    Total Riders = 11    Groups = 6,,
,1,"ADEMIR SILVA JR, CHIP-N-DALE, OAKHURST, NJ"
,2,"MIGUEL CASTRO, ALLTOW WRECKING CREW/YESS, ORLANDO, FL"
,3,"JOSH SMITH, DK BIKES/CORSA RACEWEAR, SPRINGBORO, OH"
,4,"BRADEN ROMER, VELOCIOUS SPORT, GREENSBORO, NC"
,5,"JOSH LEKAUNAS, STR/SPINTECH RACING, DELRAY BEACH, FL"
,6,"ROBERT PETTINELLI, ALLTOW WRECKING CREW/YESS, SLINGERLANDS, NY"
,7,"BRIAN STRIEBY, BMX MANIA, SYRACUSE, IN"
,8,"DYLAN SHANKS, YESS BMX, BEND, OR"
,,
Women Pro    Total Riders = 5    Groups = 1,,
,1,"FELICIA STANCIL, SUPERCROSS BMX, INDIANAPOLIS, IN"
,2,"ASHLEY VERHAGEN, FACTORY FULL TILT/RADIO, PHOENIX, AZ"
,3,"ELIDA BEEMAN, POWERLITE-DANSCOMP-DFR, LANSING, MI"
,4,"SAMANTHA MILLER, RIVAL RACING, PITTSBURGH, PA"
,5,"KALEE REYNOLDS, STOCKBRIDGE, GA"
,,
AA Pro    Total Riders = 8    Groups = 1,,
,1,"CONNOR FIELDS, CHASE BMX / ELEVN / IKON, HENDERSON, NV"
,2,"JUSTIN POSEY, MONGOOSE/ANSWER BMX, CHANDLER, AZ"
,3,"KENNETH GUSTAFSON, THRODWN, PARKER, CO"
,4,"MAX CAIRNS, CHASE/ECI, HENDERSON, NV"
,5,"COLE TESAR, RIVAL RACING, HUNTERSVILLE, NC"
,6,"COREY REID, TEMPE, AZ"
,7,"ALEC BOB, FACTORY FREE AGENT-BOX, PLANO, TX"
,8,"ANDREW HUGHES, FORMULA BMX, SYDNEY, NSW"
,,
6 & Under Mixed Open    Total Riders = 12    Groups = 2,,
,1,"MAYA GADBOIS, NO XCUSES ANSWER BMX, SANTA CLARITA, CA"
,2,"COLE STAPULA, WHITE LAKE, MI"
,3,"JAKE CERASA, DIRT FACTORY, BELVIDERE, IL"
,4,"WYATT CLARK, BLACKCROWN NORTHEAST, BETHEL PARK, PA"
,5,"ELI KETTERING, CAMP THREE, ELIZABETH, PA"
,6,"CALI KOPETSKIE, VELOCITY BIKE CO, BURLINGTON, NC"
,8,"NICOLAS (THE MAGIC MAN) MENDEZ, HIGH GRADE RACING TEAM, MIAMI, FL"
,8,"TROY GREENE, MIAMI GARDENS, FL"
,,
7-8 Mixed Open    Total Riders = 7    Groups = 1,,
,1,"JENNAVECIA KLEMZ, BLACK WIDOW BMX, BRAHAM, MN"
,2,"CALLIE CLIFFORD, CANADA-DAYLIGHT CYCLES, HURRICANE, UT"
,3,"ALAN DECKER, POWERS BIKE SHOP, ALEXANDRIA, VA"
,4,"DOMINICK DUNN, VELOCITY BIKE COMPANY, MEBANE, NC"
,5,"SOPHIA WENZEL, ALLTOW, KINGSTON, NY"
,6,"JACKSON POCHMARA, MOTOR CITY BMX, LAKE ORION, MI"
,,
9-10 Mixed Open    Total Riders = 8    Groups = 1,,
,1,"BREEANNE VAUGHAN, CANADA-FACTORY ORCA BOMBSHELL, WALNUT, CA"
,2,"ZOE (THE Z) DANNENBERG, RIVAL RACING, NICHOLASVILLE, KY"
,3,"JENNA MILLER, FACTORY REMIX, SAUGERTIES, NY"
,4,"KAYLIE CERASA, DIRT FACTORY, BELVIDERE, IL"
,5,"HUDSON MURPHY, HAP’S BMX, PARRISH, FL"
,6,"REAGAN RICE, RIVAL RACING, PLAINFIELD, IN"
,7,"HADYN DEMILLE, CHIP-N-DALE, DOROTHY, NJ"
,,
11-12 Mixed Open    Total Riders = 9    Groups = 2,,
,1,"DANICA BAILEY, ELITE BICYCLES/VENDETTA, SMITHFIELD, RI"
,2,"EMMA CAVNER, CANADA-ALBES, ROCKFORD, MI"
,3,"EMMA MARTIN, ELKRIDGE, MD"
,4,"DOMINIC TOSCANO, BLACK CROWN BIKE SHOP, OWINGS MILLS, MD"
,5,"BENJAMIN LOSER, JEM3, FORT MILL, SC"
,6,"DYLAN WILDE, STYLIN, CLEMENTON, NJ"
,7,"VINCENT VIA, GET-A-GRIP, FAIRVAX, VA"
,8,"HENRY BOROWSKI, POWERS BIKE SHOP, WALDORF, MD"
,,
13-14 Mixed Open    Total Riders = 5    Groups = 1,,
,1,"GRECIA CRISTODULO, FACTORY SSQUARED, DALLAS, TX"
,2,"TREVOR HARRIS, BLUEGRASS ANSWER/SSQUARED, LOUISVILLE, KY"
,3,"GABRELLE ROSS, NORTHEAST FACTORY YESS, COLUMBUS, OH"
,4,"DYLAN SEBRELL, REAL TIME BMX, CANTON, OH"
,,
6 & Under Open    Total Riders = 3    Groups = 1,,
,1,"ALEX INGHAM, REAL TIME BMX, LOVELAND, OH"
,2,"JACOB LACHOWICZ, TACKLEBOX RACING, CLARKSVILLE, TN"
,3,"PARKER GRAVES, 2G RACING, HOLLYWOOD, MD"
,,
7-8 Open    Total Riders = 8    Groups = 1,,
,1,"JACOB ""U KNOW"" GREENWELL, BLACK CROWN BIKE SHOP, MECHANICSVILLE, MD"
,2,"JOSEPH MATHER, THRODWN, OMAHA, NE"
,3,"ANDRES(LIL MACHINE) ANDRADE, FACTORY BOMBSHELL/AVENT, MIAMI, FL"
,4,"MASON LEASURE, WIKID RACING, AKRON, OH"
,5,"MAX MEINEL, TNT BICYCLES CT, MONROE, CT"
,6,"BLAKE GRAVES, 2G RACING, HOLLYWOOD, MD"
,7,"MICHAEL BEATTIE, POWERS BIKE SHOP, POTTSTOWN, PA"
,,
9-10 Open    Total Riders = 9    Groups = 2,,
,1,"MATTEO PIGO, FACTORY BLACKCROWN BMX, DALLAS, GA"
,2,"JAXSON SHIMKO, CLASS ACT RACING, PITTSBURGH, PA"
,3,"BLAKE TEAGUE, YESS BMX, FRANKTOWN, CO"
,4,"JC PATEMAN, CHIP-N-DALE, JACKSON, NJ"
,5,"BRAXTON LEASURE, WIKID RACING, AKRON, OH"
,6,"TY RAWLINGS, ALPHA DEVELOPMENT, ALLISON PARK, PA"
,7,"MATTHEW PETRIE, CRANKOUT, BLASDELL, NY"
,8,"CANYON WHITESIDE, MOTO MALITIA, SANDY, UT"
,,
11-12 Open    Total Riders = 13    Groups = 2,,
,1,"TREY POCHMARA, MOTOR CITY BMX, ORION, MI"
,2,"SEBASTIAN BETTINGER, LDC, RALEIGH, NC"
,3,"(ALOHA-JOE) JOE DRAWENEK, CANADA-FACTORY SSQUARED, NEENAH, WI"
,4,"JACOB MEARES, BLACK CROWN BIKE SHOP, PITTSBURGH, PA"
,5,"HAYDEN NOLAND, REGGIES'S BIKE SHOP, PETERSBURG, MI"
,6,"TOMMY BRUNEY, FACTORY FULL TILT/RADIO, PITTSBURGH, PA"
,7,"BRIAN CHARLES, MOORESVILLE, NC"
,8,"WILL ROSS, NORTHEAST FACTORY YESS, METHUEN, MA"
,,
13-14 Open    Total Riders = 5    Groups = 1,,
,1,"BRANDON BREDEWEG, FACTORY SSQUARED, ALLENDALE, MI"
,2,"TYLER BAILEY, ELITE BICYCLES/VENDETTA, SMITHFIELD, RI"
,3,"ANDREW DOROFEE, EGG HARBOR TOWNSHIP, NJ"
,4,"STEVEN MILLER, CIRCLE CITY BMXTREME TEA, ENTERPRISE, AL"
,,
15-16 Open    Total Riders = 7    Groups = 1,,
,1,"RICO BEARMAN, SPEEDCO/AVIAN, AUCKLAND"
,2,"SOLOMON GOODWIN, CROSSROADS/RIVAL, ASHLEY, IN"
,3,"PAT FEATHERBY, QUEENSLAND, QLD"
,4,"HARRISON MURPHY, HAPS BMX, PARRISH, FL"
,5,"STYLER KROPP, REAL TIME BMX, STOW, OH"
,6,"ALEXANDER ALBRO, SENECA FALLS, NY"
,,
17-20 Open    Total Riders = 6    Groups = 1,,
,1,"JAMES PLUMMER, BLACK WIDOW BMX, SAINT FRANCIS, MN"
,2,"JUAN GOMEZ, MUDSLINGERS BIKE SHOP, HOWARD BEACH, NY"
,3,"JAMES KELLY, GATENINE/FLY RACING, DAYTON, OH"
,4,"JUSTIN RINCON, REGGIES'S BIKE SHOP, ADRIAN, MI"
,5,"JEFFREY ORLANDI, YESS NORTHEAST FACTORY, CHICOPEE, MA"
,,
10 & Under Girls Cruiser    Total Riders = 13    Groups = 2,,
,1,"BREEANNE VAUGHAN, CANADA-FACTORY ORCA BOMBSHELL, WALNUT, CA"
,2,"LILY HINTON, POWERLITE-DANSCOMP-DFR, BROOKFIELD, IL"
,3,"MIA CUSTER, FACTORY BLACKCROWN BMX, BRIDGETON, NJ"
,4,"CARIS MCCONNELL, CANADA-FACTORY SSQUARED, BRENTWOOD, TN"
,5,"ISABELLA STEVENS, FACTORY SSQUARED, NEENAH, WI"
,6,"CAMRYN SEARFOSS, ALL AMERICAN BMXCHASERSP, NORWICH, NY"
,7,"CRYSTINA PATRICK, ALBES ZOLLIPOPS, HORSEHEADS, NY"
,8,"ISABELLA GEORGE, VELOCITY BIKE CO, DUMFRIES, VA"
,,
11-12 Girls Cruiser    Total Riders = 9    Groups = 2,,
,1,"KYLEE NIEDERBERGER, FACTORY ANSWER, JARRETTSVILLE, MD"
,2,"EMILY (ROADRASH) HAUGEN, VENOM/BMA, ISANTI, MN"
,3,"OLIVE HINTON, POWERLITE-DANSCOMP-DFR, BROOKFIELD, IL"
,4,"KEIRA AMARIS, TNT NATIONAL, MASTIC BEACH, NY"
,5,"ALLISON LAUGHLIN, ALBES, HORSEHEADS, NY"
,6,"RYLEIGH(THE ROCKET)HERRERA, VELOCITY BIKE CO, HERRIMAN, UT"
,7,"COURTNEY PERRYE, BLACK CROWN, CONNEAUTVILLE, PA"
,8,"MATEA CASTORAL, D4 RACING, LAKEHURST, NJ"
,,
13-14 Girls Cruiser    Total Riders = 6    Groups = 1,,
,1,"KALI (WEST COAST) STREETER, VENOM/BMA, BLAINE, MN"
,2,"ADDISON SHREVE, CLAYBORN/ANSWER FACTORY, SEVERN, MD"
,3,"MADILYN RAYNE MATIKO, HYPER BODY ARMOR, FAIRLESS HILLS, PA"
,4,"KAYLYN MILLER, RIVAL RACING, UNION, KY"
,5,"ASHLEIGH MECH, THRODWN DEVO, PASADENA, MD"
,,
15-16 Girls Cruiser    Total Riders = 4    Groups = 1,,
,1,"TIFFANY HUBER, FACTORY BLACKCROWN BMX, IJAMSVILLE, MD"
,2,"SYDNEY SCHLOTTERBECK, CANADA-1-800 KAOS, HAGERSTOWN, MD"
,3,"BROOKE KAELBLE, RIDE LIKE A GIRL, EGG HARBOR TWP, NJ"
,,
17-20 Women Cruiser    Total Riders = 4    Groups = 1,,
,1,"KORIE GILBERT, FACTORY BLACKCROWN BMX, PEARLAND, TX"
,2,"MARIANA GIGLIUTO, MARIAN UNIVERSITY, CLINTONDALE, NY"
,3,"DJ HARVEY, BLACK CROWN BIKE SHOP, ELKRIDGE, MD"
,,
21-30 Women Cruiser    Total Riders = 5    Groups = 1,,
,1,"CHEYENNE NOUD, FACTORY POWERS BIKE SHOP, RIDGE, NY"
,2,"EMILY FISK, COASTAL RACING, MEBANE, NC"
,3,"REBECCA (LA QUESA BLANCA) ROBISON, FTB BMX, GREENSBORO, NC"
,4,"AMANDA BURLINGAME, LAKE CITY, PA"
,,
31-35 Women Cruiser    Total Riders = 5    Groups = 1,,
,1,"CARLEY YOUNG, RIDE LIKE A GIRL/DANS COMP, PITTSBURGH, PA"
,2,"DANIELA CIFUENTES, CHIP-N-DALE, MOUNT HOLLY, NJ"
,3,"KATIE WALKER, WILMINGTON, DE"
,4,"REBECCA DEMILLE, CHIP-N-DALE, DOROTHY, NJ"
,,
36-40 Women Cruiser    Total Riders = 6    Groups = 1,,
,1,"BROOKE CAVNER, ALBES, ROCKFORD, MI"
,2,"LISA WEBB, CANADA-1-800 KAOS, QUEENSTOWN, MD"
,3,"JENN RIST, BIKE DOCTOR, CROWNSVILLE, MD"
,4,"STEPHANIE PETRIE, BLASDELL, NY"
,5,"STEFANIE BLACKBURN, WARPED BMX, GRANBY, CT"
,,
41-45 Women Cruiser    Total Riders = 4    Groups = 1,,
,1,"ANGELA CONSTANTINO, COASTAL RACING, WHITSETT, NC"
,2,"CONNIE RAMSEY, FORT GEORGE G MEADE, MD"
,3,"KELLY AMARIS, TNT NATIONAL, MASTIC BEACH, NY"
,,
46-50 Women Cruiser    Total Riders = 5    Groups = 1,,
,1,"CHRISSY PIPER, JAWBREAKER, LOS ANGELES, CA"
,2,"SUSIE LEVAN, TNT BICYCLES FACTORY, NORTH PLAINFIELD, NJ"
,3,"(TURBO) TARA PETTIT, CANADA-1-800 KAOS, MILFORD, DE"
,4,"MIA RITTENHOUSE, GATENINE, DAYTON, OH"
,,
56 & Over Women Cruiser    Total Riders = 3    Groups = 1,,
,1,"SUZANNE BORLAND, GILBERT, AZ"
,2,"SHELLY ZIMMERMAN, POWERS BIKE SHOP, MANASSAS, VA"
,3,"JANNA STAPLES, EXTREME TEAM, SALT LAKE CITY, UT"
,,
7 & Under Cruiser    Total Riders = 8    Groups = 1,,
,1,"MARSHALL WARNER, FACTORY FREE AGENT-BOX, SMITHSBURG, MD"
,2,"ANDREW PROBERT, FTB BMX, LAKE MARY, FL"
,3,"ALEX INGHAM, REAL TIME BMX, LOVELAND, OH"
,4,"JENSON KOLL, HUTELIN RACING, LAKE WALES, FL"
,5,"CLYDE SANTOS, LANCASTER, PA"
,6,"KAI GRAY, WIKID RACING, TALLMADGE, OH"
,7,"JACKSON STAUFFER, BLACK WIDOW BMX, FARIBAULT, MN"
,,
8 Cruiser    Total Riders = 15    Groups = 3,,
,1,"ACE LAACK, BLACK WIDOW BMX, ROCHESTER, MN"
,2,"WYATT HICKS, FACTORY BLACKCROWN BMX, KENNESAW, GA"
,3,"COGAN MARTIN-KERSEY, FACTORY POWERS BIKE SHOP, WOODBRIDGE, VA"
,4,"SAMUEL LACHOWICZ, TACKLEBOX RACING, CLARKSVILLE, TN"
,5,"DECLAN SIMS, TRIFECTA/C3/PAP&DD, TRAFFORD, PA"
,6,"PALMER WARD, A&E RACING, LOUISVILLE, KY"
,7,"CADEN IKERD, WRENCHMAN RACING, RALEIGH, NC"
,8,"JAXON KOPETSKIE, NEVER GIVE UP, BURLINGTON, NC"
,,
9 Cruiser    Total Riders = 9    Groups = 2,,
,1,"JUSTIN DONAHUE, RACER ARMY RACER CONCEPTS, CAROLINA, RI"
,2,"TAYLOR KOLL, HUTELIN RACING, LAKE WALES, FL"
,3,"JAYDEN LINVILLE, A&E RACING, RIVERSIDE, OH"
,4,"EVAN DOUGLASS, BLACK CROWN, POWDER SPRINGS, GA"
,5,"JACOB LANGE, RACER CONCEPTS, FRIENDSHIP, WI"
,6,"TYLER PEDITTO, FACTORY SAN JUAN POOLS, MAPLE SHADE, NJ"
,7,"BRITON RYAN, MACH 1 RACING, OSSINING, NY"
,8,"LIAM SANDERS, THRODWN DEVELOPMENT, LAFAYETTE, IN"
,,
10 Cruiser    Total Riders = 11    Groups = 2,,
,1,"MASON HAYES, C-YAA, DENVER, NC"
,2,"PIERCE REINHART, BETHEL PARK, PA"
,3,"CHRIS FELKER, FACTORY RIFT/TANGENT, ROCK HILL, SC"
,4,"MILES KEE, ASHEVILLE, NC"
,5,"BRANDEN (THE DARK KNIGHT) TURPIN, STANDARD BYKE CO, SAINT CHARLES, MO"
,6,"PARKER TRAMPOSCH, CANADA-ALPHA, CORAM, NY"
,7,"PERRY MILLER, HAMPTON BMX, HAMPTON, VA"
,8,"TRAVIS MANCUSO, CLAYBORN FACTORY/ANSWER, SYKESVILLE, MD"
,,
11 Cruiser    Total Riders = 11    Groups = 2,,
,1,"RILEY ALLEN, FACTORY RIFT/TANGENT, FORT MILL, SC"
,2,"PHILIP RAMSEY, BLACK CROWN BIKE SHOP, FORT GEORGE G MEADE, MD"
,3,"GAVIN BRADLEY, MOM & DAD, DAYTON, OH"
,4,"NATHAN ANDERSON, BLACK WIDOW BMX, ALBERTVILLE, MN"
,5,"ALEX MARSHALL, TOXIC RACING, WALLKILL, NY"
,6,"ALEX BARNHART, EPOUTDOORS.COM, MARTINSBURG, WV"
,7,"DYLAN SUNDAY, HYPER BODY ARMOR, EGG HARBOR TOWNSHIP, NJ"
,8,"DYLAN BUNKER, VALRICO, FL"
,,
12 Cruiser    Total Riders = 10    Groups = 2,,
,1,"PARKER RESPASS, WIAWIS/LSG, CHESAPEAKE, VA"
,2,"JOSEPH MARTIN, FACTORY SSQUARED, MOHRSVILLE, PA"
,3,"HARLEY DAIS, BLACK WIDOW BMX, WINONA, MN"
,4,"BODE BEIGHLEY, LETHAL BMX/SPEEDCO, BUFFALO, MN"
,5,"COLLIER KEE, ASHEVILLE, NC"
,6,"JONATHAN MANNS, BLACK CROWN BIKE SHOP, IRWIN, PA"
,7,"CADE MCCONNELL, FACTORY SSQUARED, BRENTWOOD, TN"
,8,"TYE YOUNG, C-YAA, DENVER, NC"
,,
13 Cruiser    Total Riders = 10    Groups = 2,,
,1,"ZACK DRINKARD, VELOCITY BIKE CO, MECHANICSVILLE, VA"
,2,"MASON CELEBUCKI, C-YAA, SCHENECTADY, NY"
,3,"BROCK (THE ROCKET) SMITH, BLACK WIDOW BMX, WEST FARGO, ND"
,4,"RICHARD REALE, TRUMBULL, CT"
,5,"PABLO LONDONO, MACH 1 RACING, BRENTWOOD, NY"
,6,"MIKE KUMER, BLACK CROWN BIKE SHOP, BETHEL PARK, PA"
,7,"CODY OSHENSKA, BIKE CONNECTION, GLEN BURNIE, MD"
,8,"ALEXANDER GEORGE, YESS BMX, DUMFRIES, VA"
,,
14 Cruiser    Total Riders = 10    Groups = 2,,
,1,"BLAKE POWELL, VELOCITY BIKE CO, VIRGINIA BEACH, VA"
,2,"EVAN MENDITTO, TNT BICYCLES FACTORY, MARLTON, NJ"
,3,"DALLAS GARDNER, POWERS BIKE SHOP, RICHMOND, VA"
,4,"KAMREN KRICKLER, SHEPHERDSTOWN, WV"
,5,"JAYDEN ROFFI, TNT BICYCLE NATIONAL, EAST NORTHPORT, NY"
,6,"CONNOR PERRYE, YESS, CONNEAUTVILLE, PA"
,7,"PRESTON ELLIOTT, POWERS BIKE SHOP, BRISTOW, VA"
,8,"ALEXANDER BOUER, EAST COAST YESS, HOWELL, NJ"
,,
15 Cruiser    Total Riders = 7    Groups = 1,,
,1,"JULIAN (THE CYBORG) BASAJ, FACTORY SSQUARED, MILWAUKEE, WI"
,2,"LOGAN DEMERSKI, OVERHAUL/J&R/SPEEDCO/AVI, FLORENCE, MA"
,3,"CHARLIE MEYER, VELOCITY, HAMPTON, VA"
,4,"AIDAN TIMMONS, CHIP-N-DALE, COLTS NECK, NJ"
,5,"MICHAEL AMARIS, TNT NATIONAL, MASTIC BCH, NY"
,6,"MASON BLACKBURN, WARPED BMX, GRANBY, CT"
,,
16 Cruiser    Total Riders = 6    Groups = 1,,
,1,"SHANE HAMPSON, POWERS BIKE SHOP TEAM, SOUND BEACH, NY"
,2,"JACOB JONES, CROSSROADS/RIVAL RACING, LOUISVILLE, KY"
,3,"NICKY SCHWARZ, VELOCITY RACING, FUQUAY VARINA, NC"
,4,"GAVIN FINK, C-YAA, SHIRLEY, NY"
,5,"JOEY MALINOWSKI, HYPER BODY ARMOR, PISCATAWAY, NJ"
,,
17-20 Cruiser    Total Riders = 5    Groups = 1,,
,1,"NATHAN DAVIDS, FACTORY SSQUARED, KAUKAUNA, WI"
,2,"BRIAN (MONEYBAGS) THIERWECHTER, CYAA, SANDWICH, MA"
,3,"KELLAN REDMOND, ROCKET RACING, HENRICO, VA"
,4,"YAVANT HAUSLER, FLYZONE RACING, ELGIN, IL"
,,
21-25 Cruiser    Total Riders = 3    Groups = 1,,
,1,"ROBERT VARGO, NOR CAL NEXT GENERATION, PITTSTON, PA"
,2,"ZACHARY HILL, LBO RACING, DUBLIN, OH"
,3,"KYLER ESMAY, THRODWN, KENT, WA"
,,
26-30 Cruiser    Total Riders = 4    Groups = 1,,
,1,"JUSTIN LEDOUX, WALLKILL, NY"
,2,"CURTIS SHOOK, DELUX BIKES, ROBESOINA, PA"
,3,"LUKE FILIPPONE, CHIP-N-DALE, WALLINGTON, NJ"
,,
31-35 Cruiser    Total Riders = 6    Groups = 1,,
,1,"NICHOLAS HURST, REAL TIME BMX, RIVERTON, IL"
,2,"JASON WAGNER, FACTORY PROPHECY USA, MISHAWAKA, IN"
,3,"KYLE BARNHART, ALBES, SAINT CLAIR SHORES, MI"
,4,"ZACHARY JOHNSRUD, MUDSLINGERS BIKE SHOP, MISHAWAKA, IN"
,5,"ROBERT DEEDE, SSQUARED WI / DCS, RHINELANDER, WI"
,,
36-40 Cruiser    Total Riders = 5    Groups = 1,,
,1,"BRIAN SHIMKO, PITTSBURGH, PA"
,2,"MARCELO OLIVEIRA, BOSTON, MA"
,3,"JEREMY BUSHNELL, THE BIKE MASTER, TACOMA, WA"
,4,"NATHAN GRUBB, LANDISVILLE, PA"
,,
41-45 Cruiser    Total Riders = 8    Groups = 1,,
,1,"MATT DALLAS, BLOT OUT GRAPHICS, COS COB, CT"
,2,"CORY SKINNER, C-YAA, HUDSON, OH"
,3,"ADAM DONOVAN, REGGIES'S BIKE SHOP, HAMBURG, NY"
,4,"SCOTT MECHLER, COLLEGEVILLE, PA"
,5,"BRIAN WICK, STANDARD BYKE COMPANY, WADSWORTH, OH"
,6,"JAMES KIMOCK, BLACK CROWN BIKE SHOP, FLEMINGTON, NJ"
,7,"GLENN MCKINNEY, PASADENA, MD"
,,
46-50 Cruiser    Total Riders = 10    Groups = 2,,
,1,"SHAWN DIPRETE, C-YAA, DUXBURY, MA"
,2,"JEREMY THOMPSON, FACTORY ANSWER, GRAHAM, NC"
,3,"JIM BRAMER, FACTORY BLACKCROWN BMX, SOUTH PARK, PA"
,4,"DREW MOTLEY, FACTORY YESS, ORMAND BEACH, FL"
,5,"NIGEL CUMMINGS, COASTAL RACING, HOBOKEN, NJ"
,6,"CHRIS CLINE, FACTORY STANDARD BYKE CO, FREDERICKTOWN, OH"
,7,"JAMES SOLOMON, 1-800 KAOS, NEWARK, MD"
,8,"JASON (JJ) MELTON, EXTREME TEAM, SOUTH JORDAN, UT"
,,
51-55 Cruiser    Total Riders = 9    Groups = 2,,
,1,"TOM JOHNSON, FACTORY YESS, PALM COAST, FL"
,2,"EDWARD WORMOLD, TEAM CORROSIVE, FLANDERS, NY"
,3,"THOMAS MERRYMAN, CRUPI RACING, MAUMEE, OH"
,4,"ONOFRE SOUZA, LODTHIAN, MD"
,5,"BILL MYERS, COASTAL RACING, BURLINGTON, NC"
,6,"CHRIS EDWARDS, ALPHA DEVELOPMENT, OWEGO, NY"
,7,"KEN (RETRO ROCKET) ROBISON, FTB BMX, GREENSBORO, NC"
,8,"DANNY (BIONIC MAN) BUSHNELL, CANADA-THE BIKE MASTER, VANCOUVER, WA"
,,
5 & Under Novice    Total Riders = 13    Groups = 2,,
,1,"CALEB GASSAWAY, AKRON, NY"
,2,"GREYSON CARR, AMELIA, OH"
,3,"CHRISTINA BISKUPSKI, RIDE LIKE A GIRL NJ, BRICK, NJ"
,4,"JAMES WALTHER, VALENCIA, PA"
,5,"KEILANI GRAY, WIKID RACING, TALLMADGE, OH"
,6,"LUKE LIBERTO, BIKE123.COM, MOUNT AIRY, MD"
,7,"RYDER SPARKS, HOLLYWOOD, MD"
,8,"JACK PASCUZZI, SLICKVILLE, PA"
,,
6 Novice    Total Riders = 10    Groups = 2,,
,1,"THIAGO SOUZA, LOTHIAN, MD"
,2,"KAIDEN WAGNER, MOM & DAD, MISHAWAKA, IN"
,3,"MADALENA JASON, ON2WHEELS, DOVER, DE"
,4,"PRESTON MCINTOSH, BROWNSVILLE, PA"
,5,"GABRIEL HOLZEN, BLUEGRASS ANSWER/SSQUARED, GOSHEN, KY"
,6,"AIDEN HUGHES, OAKDALE, PA"
,7,"MEREDITH CLARK, TOPEKA, KS"
,8,"HANNAH MILLER, APALACHIN, NY"
,,
7 Novice    Total Riders = 3    Groups = 1,,
,1,"CALEB MOLYNEAUX, PITTSBURGH, PA"
,2,"DOMINICK  BROOKS, BEAVER FALLS, PA"
,3,"HARPER HORNEMAN, ARLINGTON, VA"
,,
8 Novice    Total Riders = 6    Groups = 1,,
,1,"LINDSAY DELVECCHIO, RACER ARMY, WEST MILFORD, NJ"
,2,"COLLEEN DENTON, RIDIN REVOLUTIONS, ENDICOTT, NY"
,3,"MICHAEL LIBERTO, BIKE123.COM, MOUNT AIRY, MD"
,4,"NATALIE MOTLUCK, TNT BICYCLES, RALEIGH, NC"
,5,"RUSTY EBERT, PITTSBURGH, PA"
,,
10 Novice    Total Riders = 3    Groups = 1,,
,1,"CARMELO SHANNON, DAVE'S SERVICE CENTER, EXPORT, PA"
,2,"ALEXIS BECK, EIGHTY FOUR, PA"
,3,"CLYDE WILHELM, FINLEYVILLE, PA"
,,
12 Novice    Total Riders = 3    Groups = 1,,
,1,"LOGAN WOZNIAK, BALTIMORE, MD"
,2,"AUSTIN BENNETT, YESS, AMANDA, OH"
,3,"DOMINIC BUFARDECI, RACER ARMY, WEST MILFORD, NJ"
,,
14 Novice    Total Riders = 5    Groups = 1,,
,1,"RYAN THOMAS, JEROME, PA"
,2,"WADE SHAFFER, FAYETTEVILLE, PA"
,3,"KEITH MILLER, MARLTON, NJ"
,4,"ZANNI VRETTOS, CHIP N DALE BMX, JOBSTOWN, NJ"
,,
21-25 Novice    Total Riders = 3    Groups = 1,,
,1,"BILL GORMAN, BOWIE, MD"
,2,"DANIELLE TUTTLE, N VANDERGRIFT, PA"
,3,"ASHLEY ROLLICK, MANASSAS, VA"
,,
36-40 Novice    Total Riders = 7    Groups = 1,,
,1,"ED GRATTON, PITTSBURGH, PA"
,2,"KENNETH PASCUZZI, SLICKVILLE, PA"
,3,"KYLE WOOD, FERRETT BMX/BLASTER, YOUNGSTOWN, OH"
,4,"TRAVIS RIFE, FIRST CLASS FITNESS, ETTERS, PA"
,5,"MAT DEMILLE, CHIP-N-DALE, DOROTHY, NJ"
,6,"JOE BATTAGLIA, EXPORT, PA"
,,
41-45 Novice    Total Riders = 3    Groups = 1,,
,1,"BRIAN KNOWLES, EVANSTON, IL"
,2,"RUSSELL HANCOCK, ROCKET RACING, MOSELEY, VA"
,3,"CHRISTOPHER MATTY, FAR HILLS, NJ"
,,
46-50 Novice    Total Riders = 8    Groups = 1,,
,1,"ANTHONY KERFONTA, APOLLO, PA"
,2,"STEVE GIVENS, RIDECO, GREENSBURG, PA"
,3,"FRANZ KELLER, RACER ARMY, MORRISTOWN, NJ"
,4,"RICK SAVAGE, VESTAL, NY"
,5,"KEN BUFARDECI, RACER ARMY, WEST MILFORD, NJ"
,6,"MARK BEATTIE, POWERS BIKE SHOP, POTTSTOWN, PA"
,7,"PAUL BROKAW, ISAIAH 40:31 RACING, MARION, NY"
,,
5 & Under Intermediate    Total Riders = 9    Groups = 2,,
,1,"NICOLAS (THE MAGIC MAN) MENDEZ, HIGH GRADE RACING TEAM, MIAMI, FL"
,2,"TROY GREENE, MIAMI GARDENS, FL"
,3,"KRISTOPHER MEINEL, TNT BICYCLES CT, MONROE, CT"
,4,"GAVIN TONN, WIKID RACING, ORIENT, OH"
,5,"BASH NOTEBOOM, FAMILY PRIDE, RIDGEFIELD, CT"
,6,"MICHAEL HUDZIK, BETHEL PARK, PA"
,7,"KYLER ONEIL, YESS BMX, CLINTON, OH"
,8,"CREW WHITESIDE, MOTO MALITIA, SANDY, UT"
,,
6 Intermediate    Total Riders = 9    Groups = 2,,
,1,"JAKE CERASA, DIRT FACTORY, BELVIDERE, IL"
,2,"COLE STAPULA, WHITE LAKE, MI"
,3,"ISAIAH SALERNO, POMPTON LAKES, NJ"
,4,"ELI KETTERING, CAMP THREE, ELIZABETH, PA"
,5,"WYATT CLARK, BLACKCROWN NORTHEAST, BETHEL PARK, PA"
,6,"JASON DENEA, ORCHARD PARK, NY"
,7,"GRAYSON TOSCANO, BLACK CROWN SOUTH, OWINGS MILLS, MD"
,8,"COOPER CAFFERTY, VIRGINIA BEACH, VA"
,,
7 Intermediate    Total Riders = 16    Groups = 3,,
,1,"JACKSON MANNS, BLACK CROWN BIKE SHOP, IRWIN, PA"
,2,"DOMINICK DUNN, VELOCITY BIKE COMPANY, MEBANE, NC"
,3,"TUCKER REDMOND, LEONARDTOWN, MD"
,4,"BRODY RYAN, MACH 1 RACING, OSSINING, NY"
,5,"CAMERON COLE, CHARLOTTE, NC"
,6,"ALAN DECKER, POWERS BIKE SHOP, ALEXANDRIA, VA"
,7,"GRANTLEY NOFTZ, REGGIES'S BIKE SHOP, TEMPERANCE, MI"
,8,"JESSE GRUBB, LANDISVILLE, PA"
,,
8 Intermediate    Total Riders = 15    Groups = 3,,
,1,"RYAN CARTECHINE, TEAM CRANKOUT, BOSTON, NY"
,2,"PARKER MURRAY, MAYS LANDING, NJ"
,3,"CHASE PURCUPILE, BLACK CROWN BIKE SHOP, JEFFERSON HILLS, PA"
,4,"RYDER DAVIDSON, 1-800 KAOS, TOMS BROOK, VA"
,5,"COLT CAFFERTY, VIRGINIA BEACH, VA"
,6,"JAXON BECK, BLACKCROWN NORTHEAST, EIGHTY FOUR, PA"
,7,"TRAVIS KELLER, RACER ARMY, MORRISTOWN, NJ"
,8,"JACKSON POCHMARA, MOTOR CITY BMX, LAKE ORION, MI"
,,
9 Intermediate    Total Riders = 11    Groups = 2,,
,1,"ROCKY LAUSMAN, BLUEGRASS ANSWER/SSQUARED, LOUISVILLE, KY"
,2,"ARCHER LINDEMAN, BLACKCROWN NORTHEAST, PHILIPSBURG, PA"
,3,"TYLER MARTIN, MONONGAHELA, PA"
,4,"EVAN GILMAN, TRUTHBMX, REISTERSTOWN, MD"
,5,"LACY PABEN, REGGIES'S BIKE SHOP, TEMPERANCE, MI"
,6,"GARRET DUHART, REALTIME, STOW, OH"
,7,"MAXWELL SHUMWAY, PITTSBURGH, PA"
,8,"CAYDEN MELILLO, MERIDAN, CT"
,,
10 Intermediate    Total Riders = 9    Groups = 2,,
,1,"EVAN MANGENO, WRENCHMAN RACING, RALEIGH, NC"
,2,"WYATT KNOWLES, FLYZONE BMX, EVANSTON, IL"
,3,"BOBBY VRETTOS, CHIP N DALE BMX, JOBSTOWN, NJ"
,4,"HUDSON MURPHY, HAP’S BMX, PARRISH, FL"
,5,"LEAH WILDE, STYLIN, CLEMENTON, NJ"
,6,"HADYN DEMILLE, CHIP-N-DALE, DOROTHY, NJ"
,7,"RYDER PENNUCCI, CANADA-STYLIN, BLAIRSTOWN, NJ"
,8,"DEEGAN HAUCK, HORSEHEADS, NY"
,,
11 Intermediate    Total Riders = 11    Groups = 2,,
,1,"EASON ""WILD THING"" VAUGHN, BLACKCROWN NORTHEAST, RALEIGH, NC"
,2,"NICHOLAS DORNIN, PITTSBURGH, PA"
,3,"KAYDEN JOHNSON, UNDERDOG, LOUISVILLE, KY"
,4,"DOMINIC TOSCANO, BLACK CROWN BIKE SHOP, OWINGS MILLS, MD"
,5,"HENRY BOROWSKI, POWERS BIKE SHOP, WALDORF, MD"
,6,"JAMES WOODALL, SOMD BMX, AVENUE, MD"
,7,"GRANT SCHMIDT, A&E RACING, FORT WRIGHT, KY"
,8,"AYDEN CREAGER, LBO RACING, COLUMBUS, OH"
,,
12 Intermediate    Total Riders = 9    Groups = 2,,
,1,"RJ HANCOCK, ROCKET RACING, MOSELEY, VA"
,2,"TIMOTHY MCCLENAHAN, EDGEWATER, MD"
,3,"BENJAMIN LOSER, JEM3, FORT MILL, SC"
,4,"CODY KENT, ERIC’S CYCLES, KENNEDY, NY"
,5,"DYLAN WILDE, STYLIN, CLEMENTON, NJ"
,6,"CAMPBELL THOMAS, BLACK CROWN NORTHEAST, JEFFERSON HILLS, PA"
,7,"JT VROLIJK, BLACK CROWN, PLUM, PA"
,8,"JOHN JOYCE, YESS, SHAKER HEIGHTS, OH"
,,
13 Intermediate    Total Riders = 8    Groups = 1,,
,1,"JOHN GRATTON, PITTSBURGH, PA"
,2,"CODY OSHENSKA, BIKE CONNECTION, GLEN BURNIE, MD"
,3,"AUBREY DOUGLASS, BLACK CROWN, POWDER SPRINGS, GA"
,4,"DYLAN SEBRELL, REAL TIME BMX, CANTON, OH"
,5,"JAY HAMILA, WESTLAKE, OH"
,6,"JOHNNY TOMBOLY, MERIDEN, CT"
,7,"KADEN DODD, FACTORY HAVOC, EGG HARBOR TWP, NJ"
,,
14 Intermediate    Total Riders = 4    Groups = 1,,
,1,"BRANDIN MORRIS, SOMD BMX, LEONARDTOWN, MD"
,2,"TREVOR HARRIS, BLUEGRASS ANSWER/SSQUARED, LOUISVILLE, KY"
,3,"HUNTER SPARKS, HOLLYWOOD, MD"
,,
15 Intermediate    Total Riders = 8    Groups = 1,,
,1,"JOSEPH HOLDEN, LANEXA, VA"
,2,"ANDREW HULL, CHAMBERSBURG, PA"
,3,"KYLE SHULTZABERGER, ROUNDHILL, VA"
,4,"ETHAN ADAMS, SUPER SQUIRREL BMX, RICHLAND, MS"
,5,"MARCUS QUERCETTI, NAPLES BMX, NAPLES, FL"
,6,"ADIAN DIEHL, TNT NATIONAL, HOLTSVILLE, NY"
,7,"MICHAEL SHERIDAN, MACH 1 RACING, MIDDLE ISLAND, NY"
,,
16 Intermediate    Total Riders = 3    Groups = 1,,
,1,"BRYAN MAXEY, SOMD, COMPTON, MD"
,2,"EDWARD PAOLUCCI, LBO RACING, AKRON, OH"
,3,"ETHAN SHREVE, SEVERN, MD"
,,
17-20 Intermediate    Total Riders = 3    Groups = 1,,
,1,"JUAN PABLO PALACIO, GMACS, RANDOLPH, NJ"
,2,"CODY FINK, SHIRLEY, NY"
,3,"NICK CASTILLO, HYPER BODY ARMOR, LEBANON, NJ"
,,
26-35 Intermediate    Total Riders = 6    Groups = 1,,
,1,"BROCK ABEL, REISTERSTOWN, MD"
,2,"THOMAS TYNER JR, 1-800 KAOS, BROADWAY, VA"
,3,"FRANK JOHNSON, BRIDGETON, NJ"
,4,"GEORGE SPARKS, HOLLYWOOD, MD"
,5,"RYAN NADLER, NOTTINGHAM, MD"
,,
36-40 Intermediate    Total Riders = 4    Groups = 1,,
,1,"NATHAN GRUBB, LANDISVILLE, PA"
,2,"JOHN GORMAN, BIKE TECH SOLUTIONS, ROCKFORD, MI"
,3,"RYAN NOFTZ, REGGIES'S BIKE SHOP, TEMPERANCE, MI"
,,
41-45 Intermediate    Total Riders = 3    Groups = 1,,
,1,"RICKY BOBBY SMITH, ODENTON, MD"
,2,"WESLEY JAMES, HILL BMX/ INT. BMX MIN., ELGIN, IL"
,3,"CHRIS CALABRESE, PASADENA, MD"
,,
46-50 Intermediate    Total Riders = 6    Groups = 1,,
,1,"JAMES LANCZ, MOORESVILLE, NC"
,2,"CLAYTON MARSHALL, TOXIC RACING, WALLKILL, NY"
,3,"MICHAEL WOHRLE, GUYS BICYCLES, LENSDALE, PA"
,4,"THOMAS CROLEY, HAMPTON BMX, VIRGINIA BEACH, VA"
,5,"MIKE DEL VECCHIO, RACER ARMY, WEST MILFORD, NJ"
,,
51 & Over Intermediate    Total Riders = 5    Groups = 1,,
,1,"WILD BILL HEATH, YESS BMX, CEDAR SPRINGS, MI"
,2,"DANNY (BIONIC MAN) BUSHNELL, CANADA-THE BIKE MASTER, VANCOUVER, WA"
,3,"JAMES VOLMER, VOLMER DRYWALL, VANDERGRIFT, PA"
,4,"JAMES SHAFFER, REAL TIME BMX, WHITE HEATH, IL"
,,
